"No.","Time","Source","Destination","Protocol","Length","Info"
"1","0.000000","192.168.219.118","3.112.52.234","UDP","631","54534  >  443 Len=589"
"2","0.070596","3.112.52.234","192.168.219.118","UDP","208","443  >  54534 Len=166"
"3","0.070597","3.112.52.234","192.168.219.118","UDP","1238","443  >  54534 Len=1196"
"4","0.070598","3.112.52.234","192.168.219.118","UDP","768","443  >  54534 Len=726"
"5","0.071043","192.168.219.118","3.112.52.234","UDP","73","54534  >  443 Len=31"
"6","0.071293","192.168.219.118","3.112.52.234","UDP","73","54534  >  443 Len=31"
"7","0.148154","3.112.52.234","192.168.219.118","UDP","69","443  >  54534 Len=27"
"8","0.256863","192.168.219.118","3.112.52.234","UDP","643","54534  >  443 Len=601"
"9","0.332281","3.112.52.234","192.168.219.118","UDP","73","443  >  54534 Len=31"
"10","0.356023","3.112.52.234","192.168.219.118","UDP","74","443  >  54534 Len=32"
"11","0.356024","3.112.52.234","192.168.219.118","UDP","1238","443  >  54534 Len=1196"
"12","0.356025","3.112.52.234","192.168.219.118","UDP","1242","443  >  54534 Len=1200"
"13","0.356026","3.112.52.234","192.168.219.118","UDP","1242","443  >  54534 Len=1200"
"14","0.356027","3.112.52.234","192.168.219.118","UDP","632","443  >  54534 Len=590"
"15","0.356028","3.112.52.234","192.168.219.118","UDP","1237","443  >  54534 Len=1195"
"16","0.356029","3.112.52.234","192.168.219.118","UDP","1242","443  >  54534 Len=1200"
"17","0.356029","3.112.52.234","192.168.219.118","UDP","1242","443  >  54534 Len=1200"
"18","0.356030","3.112.52.234","192.168.219.118","UDP","634","443  >  54534 Len=592"
"19","0.356031","3.112.52.234","192.168.219.118","UDP","1237","443  >  54534 Len=1195"
"20","0.356304","192.168.219.118","3.112.52.234","UDP","73","54534  >  443 Len=31"
"21","0.356306","192.168.219.118","3.112.52.234","UDP","73","54534  >  443 Len=31"
"22","0.359874","3.112.52.234","192.168.219.118","UDP","716","443  >  54534 Len=674"
"23","0.388836","192.168.219.118","3.112.52.234","UDP","73","54534  >  443 Len=31"
"24","0.400086","192.168.219.118","3.112.52.234","UDP","348","54534  >  443 Len=306"
"25","0.434905","3.112.52.234","192.168.219.118","UDP","69","443  >  54534 Len=27"
"26","0.475809","3.112.52.234","192.168.219.118","UDP","73","443  >  54534 Len=31"
"27","0.496170","3.112.52.234","192.168.219.118","UDP","74","443  >  54534 Len=32"
"28","0.496171","3.112.52.234","192.168.219.118","UDP","1238","443  >  54534 Len=1196"
"29","0.496173","3.112.52.234","192.168.219.118","UDP","1242","443  >  54534 Len=1200"
"30","0.496173","3.112.52.234","192.168.219.118","UDP","1242","443  >  54534 Len=1200"
"31","0.496174","3.112.52.234","192.168.219.118","UDP","632","443  >  54534 Len=590"
"32","0.496175","3.112.52.234","192.168.219.118","UDP","1237","443  >  54534 Len=1195"
"33","0.496176","3.112.52.234","192.168.219.118","UDP","1242","443  >  54534 Len=1200"
"34","0.496177","3.112.52.234","192.168.219.118","UDP","1242","443  >  54534 Len=1200"
"35","0.496178","3.112.52.234","192.168.219.118","UDP","634","443  >  54534 Len=592"
"36","0.496179","3.112.52.234","192.168.219.118","UDP","1237","443  >  54534 Len=1195"
"37","0.496490","192.168.219.118","3.112.52.234","UDP","73","54534  >  443 Len=31"
"38","0.496492","192.168.219.118","3.112.52.234","UDP","73","54534  >  443 Len=31"
"39","0.499878","3.112.52.234","192.168.219.118","UDP","738","443  >  54534 Len=696"
"40","0.572098","3.112.52.234","192.168.219.118","UDP","69","443  >  54534 Len=27"
"41","0.606443","192.168.219.118","3.112.52.234","UDP","73","54534  >  443 Len=31"
"42","0.703672","192.168.219.118","3.112.52.234","UDP","349","54534  >  443 Len=307"
"43","0.780013","3.112.52.234","192.168.219.118","UDP","73","443  >  54534 Len=31"
"44","0.796732","3.112.52.234","192.168.219.118","UDP","103","443  >  54534 Len=61"
"45","0.796733","3.112.52.234","192.168.219.118","UDP","1238","443  >  54534 Len=1196"
"46","0.796734","3.112.52.234","192.168.219.118","UDP","1242","443  >  54534 Len=1200"
"47","0.796734","3.112.52.234","192.168.219.118","UDP","1242","443  >  54534 Len=1200"
"48","0.796735","3.112.52.234","192.168.219.118","UDP","632","443  >  54534 Len=590"
"49","0.796736","3.112.52.234","192.168.219.118","UDP","1237","443  >  54534 Len=1195"
"50","0.796737","3.112.52.234","192.168.219.118","UDP","1242","443  >  54534 Len=1200"
"51","0.796738","3.112.52.234","192.168.219.118","UDP","1242","443  >  54534 Len=1200"
"52","0.796739","3.112.52.234","192.168.219.118","UDP","634","443  >  54534 Len=592"
"53","0.796739","3.112.52.234","192.168.219.118","UDP","1237","443  >  54534 Len=1195"
"54","0.796991","192.168.219.118","3.112.52.234","UDP","73","54534  >  443 Len=31"
"55","0.796993","192.168.219.118","3.112.52.234","UDP","73","54534  >  443 Len=31"
"56","0.796993","192.168.219.118","3.112.52.234","UDP","73","54534  >  443 Len=31"
"57","0.801300","3.112.52.234","192.168.219.118","UDP","807","443  >  54534 Len=765"
"58","0.846669","3.112.52.234","192.168.219.118","UDP","68","443  >  54534 Len=26"
"59","0.911098","192.168.219.118","3.112.52.234","UDP","73","54534  >  443 Len=31"
"60","7.918213","192.168.219.118","1.214.68.2","DNS","75","Standard query 0x9eae HTTPS ocsp2.apple.com"
"61","7.918410","192.168.219.118","1.214.68.2","DNS","75","Standard query 0x5f53 A ocsp2.apple.com"
"62","7.933633","1.214.68.2","192.168.219.118","DNS","159","Standard query response 0x9eae HTTPS ocsp2.apple.com CNAME ocsp2.g.aaplimg.com SOA a.gslb.aaplimg.com"
"63","7.933634","1.214.68.2","192.168.219.118","DNS","137","Standard query response 0x5f53 A ocsp2.apple.com CNAME ocsp2.g.aaplimg.com A 17.253.69.208 A 17.253.69.198"
"64","7.934313","192.168.219.118","1.214.68.2","DNS","79","Standard query 0x0f75 HTTPS ocsp2.g.aaplimg.com"
"65","7.935944","192.168.219.118","17.253.69.208","TCP","78","54478  >  443 [SYN, ECE, CWR] Seq=0 Win=65535 Len=0 MSS=1460 WS=64 TSval=2470276370 TSecr=0 SACK_PERM"
"66","7.948792","1.214.68.2","192.168.219.118","DNS","217","Standard query response 0x0f75 HTTPS ocsp2.g.aaplimg.com CNAME ocsp2.apple.com.edgekey.net CNAME e3528.dscg.akamaiedge.net SOA n0dscg.akamaiedge.net"
"67","7.978516","192.168.219.118","1.214.68.2","DNS","86","Standard query 0x44d0 A app-analytics-services.com"
"68","7.987476","17.253.69.208","192.168.219.118","TCP","74","443  >  54478 [SYN, ACK, ECE] Seq=0 Ack=1 Win=33212 Len=0 MSS=1456 SACK_PERM TSval=1165806723 TSecr=2470276370 WS=512"
"69","7.988504","192.168.219.118","17.253.69.208","TCP","66","54478  >  443 [ACK] Seq=1 Ack=1 Win=131456 Len=0 TSval=2470276422 TSecr=1165806723"
"70","7.988532","192.168.219.118","17.253.69.208","TCP","1510","54478  >  443 [ACK] Seq=1 Ack=1 Win=131456 Len=1444 TSval=2470276423 TSecr=1165806723 [TCP PDU reassembled in 71]"
"71","7.988540","192.168.219.118","17.253.69.208","TLSv1.3","160","Client Hello (SNI=ocsp2.apple.com)"
"72","7.990365","1.214.68.2","192.168.219.118","DNS","102","Standard query response 0x44d0 A app-analytics-services.com A 142.250.76.14"
"73","8.040149","17.253.69.208","192.168.219.118","TCP","66","443  >  54478 [ACK] Seq=1 Ack=1539 Win=32256 Len=0 TSval=1165806776 TSecr=2470276423"
"74","8.040994","17.253.69.208","192.168.219.118","TLSv1.3","1510","Server Hello, Change Cipher Spec"
"75","8.040995","17.253.69.208","192.168.219.118","TCP","1510","443  >  54478 [PSH, ACK] Seq=1445 Ack=1539 Win=32256 Len=1444 TSval=1165806777 TSecr=2470276423 [TCP PDU reassembled in 76]"
"76","8.040996","17.253.69.208","192.168.219.118","TLSv1.3","1271","Application Data"
"77","8.041363","192.168.219.118","17.253.69.208","TCP","66","54478  >  443 [ACK] Seq=1539 Ack=4094 Win=127424 Len=0 TSval=2470276475 TSecr=1165806777"
"78","8.041365","192.168.219.118","17.253.69.208","TCP","66","[TCP Window Update] 54478  >  443 [ACK] Seq=1539 Ack=4094 Win=131072 Len=0 TSval=2470276475 TSecr=1165806777"
"79","8.051850","192.168.219.118","17.253.69.208","TLSv1.3","146","Change Cipher Spec, Application Data"
"80","8.053422","192.168.219.118","17.253.69.208","TLSv1.3","559","Application Data"
"81","8.059776","192.168.219.118","1.214.68.2","DNS","76","Standard query 0xbf8b HTTPS katalk.kakao.com"
"82","8.059902","192.168.219.118","1.214.68.2","DNS","76","Standard query 0xf25a A katalk.kakao.com"
"83","8.073099","1.214.68.2","192.168.219.118","DNS","143","Standard query response 0xf25a A katalk.kakao.com CNAME brewery-talk-external-azp9mem5.kgns1.com A 211.183.210.21"
"84","8.073605","1.214.68.2","192.168.219.118","DNS","179","Standard query response 0xbf8b HTTPS katalk.kakao.com CNAME brewery-talk-external-azp9mem5.kgns1.com SOA gsx-gslb11.kakao.com"
"85","8.075104","192.168.219.118","211.183.210.21","TCP","78","54479  >  443 [SYN, ECE, CWR] Seq=0 Win=65535 Len=0 MSS=1460 WS=64 TSval=2724949932 TSecr=0 SACK_PERM"
"86","8.087479","211.183.210.21","192.168.219.118","TCP","74","443  >  54479 [SYN, ACK, ECE] Seq=0 Ack=1 Win=43440 Len=0 MSS=1440 SACK_PERM TSval=3124588941 TSecr=2724949932 WS=4096"
"87","8.087783","192.168.219.118","211.183.210.21","TCP","66","54479  >  443 [ACK] Seq=1 Ack=1 Win=131392 Len=0 TSval=2724949945 TSecr=3124588941"
"88","8.087793","192.168.219.118","211.183.210.21","TCP","1494","54479  >  443 [ACK] Seq=1 Ack=1 Win=131392 Len=1428 TSval=2724949945 TSecr=3124588941 [TCP PDU reassembled in 89]"
"89","8.087794","192.168.219.118","211.183.210.21","TLSv1.2","177","Client Hello (SNI=katalk.kakao.com)"
"90","8.100276","211.183.210.21","192.168.219.118","TCP","66","443  >  54479 [ACK] Seq=1 Ack=1429 Win=45056 Len=0 TSval=3124588954 TSecr=2724949945"
"91","8.100278","211.183.210.21","192.168.219.118","TCP","66","443  >  54479 [ACK] Seq=1 Ack=1540 Win=45056 Len=0 TSval=3124588954 TSecr=2724949945"
"92","8.102710","17.253.69.208","192.168.219.118","TLSv1.3","597","Application Data, Application Data"
"93","8.103113","192.168.219.118","17.253.69.208","TCP","66","54478  >  443 [ACK] Seq=2112 Ack=4625 Win=130560 Len=0 TSval=2470276537 TSecr=1165806839"
"94","8.103199","192.168.219.118","17.253.69.208","TLSv1.3","97","Application Data"
"95","8.104556","211.183.210.21","192.168.219.118","TLSv1.2","1514","Server Hello"
"96","8.104557","211.183.210.21","192.168.219.118","TCP","1514","443  >  54479 [PSH, ACK] Seq=1449 Ack=1540 Win=45056 Len=1448 TSval=3124588957 TSecr=2724949945 [TCP PDU reassembled in 97]"
"97","8.104558","211.183.210.21","192.168.219.118","TLSv1.2","1266","Certificate"
"98","8.104559","211.183.210.21","192.168.219.118","TLSv1.2","135","Server Key Exchange, Server Hello Done"
"99","8.104559","17.253.69.208","192.168.219.118","TLSv1.3","1388","Application Data"
"100","8.104560","17.253.69.208","192.168.219.118","TLSv1.3","1388","Application Data"
"101","8.104561","17.253.69.208","192.168.219.118","TLSv1.3","444","Application Data"
"102","8.104562","17.253.69.208","192.168.219.118","TLSv1.3","1201","Application Data"
"103","8.104563","17.253.69.208","192.168.219.118","TLSv1.3","603","Application Data"
"104","8.104776","192.168.219.118","211.183.210.21","TCP","66","54479  >  443 [ACK] Seq=1540 Ack=4166 Win=127232 Len=0 TSval=2724949962 TSecr=3124588957"
"105","8.104777","192.168.219.118","211.183.210.21","TCP","66","[TCP Window Update] 54479  >  443 [ACK] Seq=1540 Ack=4166 Win=131072 Len=0 TSval=2724949962 TSecr=3124588957"
"106","8.104787","192.168.219.118","17.253.69.208","TCP","66","54478  >  443 [ACK] Seq=2143 Ack=9319 Win=126400 Len=0 TSval=2470276539 TSecr=1165806840"
"107","8.104789","192.168.219.118","17.253.69.208","TCP","66","[TCP Window Update] 54478  >  443 [ACK] Seq=2143 Ack=9319 Win=131072 Len=0 TSval=2470276539 TSecr=1165806840"
"108","8.107511","192.168.219.118","1.214.68.2","DNS","95","Standard query 0x5e97 A bag-cdn.itunes-apple.com.akadns.net"
"109","8.108977","192.168.219.118","211.183.210.21","TLSv1.2","159","Client Key Exchange, Change Cipher Spec, Encrypted Handshake Message"
"110","8.119370","1.214.68.2","192.168.219.118","DNS","256","Standard query response 0x5e97 A bag-cdn.itunes-apple.com.akadns.net CNAME bag-cdn-lb2.itunes-apple.com.akadns.net CNAME bag-cdn-akam.itunes-apple.com.akadns.net CNAME bag.itunes.apple.com.edgesuite.net CNAME a68.dscg4.akamai.net A 23.52.128.133 A 23.52.128.140"
"111","8.120601","211.183.210.21","192.168.219.118","TLSv1.2","117","Change Cipher Spec, Encrypted Handshake Message"
"112","8.120911","192.168.219.118","211.183.210.21","TCP","66","54479  >  443 [ACK] Seq=1633 Ack=4217 Win=131072 Len=0 TSval=2724949978 TSecr=3124588974"
"113","8.121053","192.168.219.118","211.183.210.21","TLSv1.2","415","Application Data"
"114","8.121241","192.168.219.118","211.183.210.21","TLSv1.2","429","Application Data"
"115","8.124451","192.168.219.118","23.52.128.140","QUIC","1242","Initial, DCID=1f6a4890bb2f7b29, PKN: 0, CRYPTO, PADDING"
"116","8.124547","192.168.219.118","23.52.128.140","QUIC","1242","Initial, DCID=1f6a4890bb2f7b29, PKN: 1, CRYPTO, PADDING"
"117","8.136485","211.183.210.21","192.168.219.118","TCP","66","443  >  54479 [ACK] Seq=4217 Ack=2345 Win=45056 Len=0 TSval=3124588990 TSecr=2724949978"
"118","8.165861","23.52.128.140","192.168.219.118","QUIC","82","Initial, SCID=145c75f58480dd2f, PKN: 1, ACK"
"119","8.166762","23.52.128.140","192.168.219.118","QUIC","1242","Initial, SCID=145c75f58480dd2f, PKN: 2, ACK, PADDING"
"120","8.168376","23.52.128.140","192.168.219.118","QUIC","1242","Initial, SCID=145c75f58480dd2f, PKN: 3, CRYPTO, PADDING"
"121","8.168962","192.168.219.118","23.52.128.140","QUIC","1242","Initial, DCID=145c75f58480dd2f, PKN: 2, ACK, PADDING"
"122","8.169992","23.52.128.140","192.168.219.118","QUIC","1242","Handshake, SCID=145c75f58480dd2f"
"123","8.169993","23.52.128.140","192.168.219.118","QUIC","1242","Handshake, SCID=145c75f58480dd2f"
"124","8.169994","23.52.128.140","192.168.219.118","QUIC","1242","Handshake, SCID=145c75f58480dd2f"
"125","8.169995","23.52.128.140","192.168.219.118","QUIC","1242","Handshake, SCID=145c75f58480dd2f"
"126","8.169996","23.52.128.140","192.168.219.118","QUIC","623","Handshake, SCID=145c75f58480dd2f"
"127","8.170406","192.168.219.118","23.52.128.140","QUIC","81","Handshake, DCID=145c75f58480dd2f"
"128","8.177341","192.168.219.118","23.52.128.140","QUIC","131","Handshake, DCID=145c75f58480dd2f"
"129","8.178925","192.168.219.118","23.52.128.140","QUIC","92","Protected Payload (KP0), DCID=145c75f58480dd2f"
"130","8.179536","192.168.219.118","23.52.128.140","QUIC","432","Protected Payload (KP0), DCID=145c75f58480dd2f"
"131","8.195654","17.253.69.208","192.168.219.118","TCP","66","443  >  54478 [ACK] Seq=9319 Ack=2143 Win=32256 Len=0 TSval=1165806932 TSecr=2470276538"
"132","8.211442","211.183.210.21","192.168.219.118","TLSv1.2","817","Application Data"
"133","8.211615","192.168.219.118","211.183.210.21","TCP","66","54479  >  443 [ACK] Seq=2345 Ack=4968 Win=130368 Len=0 TSval=2724950069 TSecr=3124589065"
"134","8.218820","23.52.128.140","192.168.219.118","QUIC","345","Protected Payload (KP0)"
"135","8.218821","23.52.128.140","192.168.219.118","QUIC","346","Protected Payload (KP0)"
"136","8.218822","23.52.128.140","192.168.219.118","QUIC","104","Protected Payload (KP0)"
"137","8.218824","23.52.128.140","192.168.219.118","QUIC","63","Protected Payload (KP0)"
"138","8.218825","23.52.128.140","192.168.219.118","QUIC","112","Protected Payload (KP0)"
"139","8.219393","192.168.219.118","23.52.128.140","QUIC","73","Protected Payload (KP0), DCID=145c75f58480dd2f"
"140","8.219395","192.168.219.118","23.52.128.140","QUIC","1294","Protected Payload (KP0), DCID=145c75f58480dd2f"
"141","8.219538","192.168.219.118","23.52.128.140","QUIC","76","Protected Payload (KP0), DCID=145c75f58480dd2f"
"142","8.220036","23.52.128.140","192.168.219.118","QUIC","65","Protected Payload (KP0)"
"143","8.222124","23.52.128.140","192.168.219.118","QUIC","1049","Protected Payload (KP0)"
"144","8.222326","192.168.219.118","23.52.128.140","QUIC","73","Protected Payload (KP0), DCID=145c75f58480dd2f"
"145","8.222543","192.168.219.118","23.52.128.140","QUIC","73","Protected Payload (KP0), DCID=145c75f58480dd2f"
"146","8.223622","23.52.128.140","192.168.219.118","QUIC","1242","Protected Payload (KP0)"
"147","8.223624","23.52.128.140","192.168.219.118","QUIC","1242","Protected Payload (KP0)"
"148","8.223625","23.52.128.140","192.168.219.118","QUIC","1242","Protected Payload (KP0)"
"149","8.223626","23.52.128.140","192.168.219.118","QUIC","1242","Protected Payload (KP0)"
"150","8.223627","23.52.128.140","192.168.219.118","QUIC","1242","Protected Payload (KP0)"
"151","8.223628","23.52.128.140","192.168.219.118","QUIC","1242","Protected Payload (KP0)"
"152","8.223629","23.52.128.140","192.168.219.118","QUIC","1242","Protected Payload (KP0)"
"153","8.223630","23.52.128.140","192.168.219.118","QUIC","1242","Protected Payload (KP0)"
"154","8.223631","23.52.128.140","192.168.219.118","QUIC","728","Protected Payload (KP0)"
"155","8.223632","23.52.128.140","192.168.219.118","QUIC","64","Protected Payload (KP0)"
"156","8.223633","23.52.128.140","192.168.219.118","QUIC","1494","Protected Payload (KP0)"
"157","8.223751","192.168.219.118","23.52.128.140","QUIC","73","Protected Payload (KP0), DCID=145c75f58480dd2f"
"158","8.244176","192.168.219.118","1.214.68.2","DNS","84","Standard query 0x3847 A sandbox.itunes.apple.com"
"159","8.256539","1.214.68.2","192.168.219.118","DNS","272","Standard query response 0x3847 A sandbox.itunes.apple.com CNAME sandbox.itunes-apple.com.akadns.net CNAME sandbox-dist.itunes-apple.com.akadns.net CNAME sandbox.itunes.apple.com.edgesuite.net CNAME a708.dsct.akamai.net A 23.50.121.162 A 23.50.121.145"
"160","8.258023","192.168.219.118","23.50.121.162","TCP","78","54480  >  443 [SYN, ECE, CWR] Seq=0 Win=65535 Len=0 MSS=1460 WS=64 TSval=3708736237 TSecr=0 SACK_PERM"
"161","8.260483","23.52.128.140","192.168.219.118","QUIC","65","Protected Payload (KP0)"
"162","8.270240","23.50.121.162","192.168.219.118","TCP","74","443  >  54480 [SYN, ACK, ECE] Seq=0 Ack=1 Win=65160 Len=0 MSS=1384 SACK_PERM TSval=1154918747 TSecr=3708736237 WS=128"
"163","8.270746","192.168.219.118","23.50.121.162","TCP","66","54480  >  443 [ACK] Seq=1 Ack=1 Win=131712 Len=0 TSval=3708736250 TSecr=1154918747"
"164","8.270760","192.168.219.118","23.50.121.162","TCP","1438","54480  >  443 [ACK] Seq=1 Ack=1 Win=131712 Len=1372 TSval=3708736250 TSecr=1154918747 [TCP PDU reassembled in 165]"
"165","8.270763","192.168.219.118","23.50.121.162","TLSv1.3","241","Client Hello (SNI=sandbox.itunes.apple.com)"
"166","8.283417","23.50.121.162","192.168.219.118","TCP","66","443  >  54480 [ACK] Seq=1 Ack=1548 Win=67200 Len=0 TSval=1154918761 TSecr=3708736250"
"167","8.283947","23.50.121.162","192.168.219.118","TLSv1.3","1514","Server Hello, Change Cipher Spec, Application Data"
"168","8.283948","23.50.121.162","192.168.219.118","TCP","1514","443  >  54480 [PSH, ACK] Seq=1449 Ack=1548 Win=67200 Len=1448 TSval=1154918762 TSecr=3708736250 [TCP PDU reassembled in 172]"
"169","8.283949","23.50.121.162","192.168.219.118","TCP","1266","443  >  54480 [PSH, ACK] Seq=2897 Ack=1548 Win=67200 Len=1200 TSval=1154918762 TSecr=3708736250 [TCP PDU reassembled in 172]"
"170","8.284188","192.168.219.118","23.50.121.162","TCP","66","54480  >  443 [ACK] Seq=1548 Ack=4097 Win=127616 Len=0 TSval=3708736263 TSecr=1154918762"
"171","8.284189","192.168.219.118","23.50.121.162","TCP","66","[TCP Window Update] 54480  >  443 [ACK] Seq=1548 Ack=4097 Win=131072 Len=0 TSval=3708736263 TSecr=1154918762"
"172","8.286697","23.50.121.162","192.168.219.118","TLSv1.3","1240","Application Data, Application Data, Application Data"
"173","8.286890","192.168.219.118","23.50.121.162","TCP","66","54480  >  443 [ACK] Seq=1548 Ack=5271 Win=129920 Len=0 TSval=3708736266 TSecr=1154918765"
"174","8.288100","23.52.128.140","192.168.219.118","QUIC","66","Protected Payload (KP0)"
"175","8.291927","192.168.219.118","23.50.121.162","TLSv1.3","146","Change Cipher Spec, Application Data"
"176","8.292530","192.168.219.118","23.50.121.162","TLSv1.3","551","Application Data"
"177","8.303557","23.50.121.162","192.168.219.118","TLSv1.3","369","Application Data"
"178","8.303558","23.50.121.162","192.168.219.118","TLSv1.3","369","Application Data"
"179","8.303773","192.168.219.118","23.50.121.162","TCP","66","54480  >  443 [ACK] Seq=2113 Ack=5877 Win=130496 Len=0 TSval=3708736283 TSecr=1154918781"
"180","8.306436","23.50.121.162","192.168.219.118","TLSv1.3","127","Application Data"
"181","8.306437","23.50.121.162","192.168.219.118","TLSv1.3","97","Application Data"
"182","8.306438","23.50.121.162","192.168.219.118","TLSv1.3","1166","Application Data"
"183","8.306439","23.50.121.162","192.168.219.118","TCP","1514","443  >  54480 [ACK] Seq=7069 Ack=2113 Win=70016 Len=1448 TSval=1154918783 TSecr=3708736272 [TCP PDU reassembled in 189]"
"184","8.306440","23.50.121.162","192.168.219.118","TCP","1514","443  >  54480 [ACK] Seq=8517 Ack=2113 Win=70016 Len=1448 TSval=1154918783 TSecr=3708736272 [TCP PDU reassembled in 189]"
"185","8.306441","23.50.121.162","192.168.219.118","TCP","1514","443  >  54480 [ACK] Seq=9965 Ack=2113 Win=70016 Len=1448 TSval=1154918783 TSecr=3708736272 [TCP PDU reassembled in 189]"
"186","8.306442","23.50.121.162","192.168.219.118","TCP","1514","443  >  54480 [ACK] Seq=11413 Ack=2113 Win=70016 Len=1448 TSval=1154918783 TSecr=3708736272 [TCP PDU reassembled in 189]"
"187","8.306443","23.50.121.162","192.168.219.118","TCP","1514","443  >  54480 [ACK] Seq=12861 Ack=2113 Win=70016 Len=1448 TSval=1154918783 TSecr=3708736272 [TCP PDU reassembled in 189]"
"188","8.306445","23.50.121.162","192.168.219.118","TCP","1514","443  >  54480 [ACK] Seq=14309 Ack=2113 Win=70016 Len=1448 TSval=1154918783 TSecr=3708736272 [TCP PDU reassembled in 189]"
"189","8.306445","23.50.121.162","192.168.219.118","TLSv1.3","727","Application Data"
"190","8.306564","192.168.219.118","23.50.121.162","TCP","66","54480  >  443 [ACK] Seq=2113 Ack=16418 Win=120576 Len=0 TSval=3708736286 TSecr=1154918783"
"191","8.306564","192.168.219.118","23.50.121.162","TCP","66","[TCP Window Update] 54480  >  443 [ACK] Seq=2113 Ack=16418 Win=131072 Len=0 TSval=3708736286 TSecr=1154918783"
"192","8.306790","192.168.219.118","23.50.121.162","TLSv1.3","97","Application Data"
"193","8.360635","23.50.121.162","192.168.219.118","TCP","66","443  >  54480 [ACK] Seq=16418 Ack=2144 Win=70016 Len=0 TSval=1154918839 TSecr=3708736286"
"194","8.496695","192.168.219.118","1.214.68.2","DNS","100","Standard query 0x9dd9 HTTPS brewery-talk-external-azp9mem5.kgns1.com"
"195","8.496806","192.168.219.118","211.183.210.21","TCP","78","54481  >  443 [SYN, ECE, CWR] Seq=0 Win=65535 Len=0 MSS=1460 WS=64 TSval=878321537 TSecr=0 SACK_PERM"
"196","8.500614","192.168.219.118","1.214.68.2","DNS","93","Standard query 0x69c7 HTTPS firebaselogging-pa.googleapis.com"
"197","8.500838","192.168.219.118","1.214.68.2","DNS","93","Standard query 0x396a A firebaselogging-pa.googleapis.com"
"198","8.509482","1.214.68.2","192.168.219.118","DNS","158","Standard query response 0x9dd9 HTTPS brewery-talk-external-azp9mem5.kgns1.com SOA gsx-gslb11.kakao.com"
"199","8.510439","211.183.210.21","192.168.219.118","TCP","74","443  >  54481 [SYN, ACK, ECE] Seq=0 Ack=1 Win=43440 Len=0 MSS=1440 SACK_PERM TSval=3100769184 TSecr=878321537 WS=4096"
"200","8.510755","192.168.219.118","211.183.210.21","TCP","66","54481  >  443 [ACK] Seq=1 Ack=1 Win=131392 Len=0 TSval=878321551 TSecr=3100769184"
"201","8.510762","192.168.219.118","211.183.210.21","TCP","1494","54481  >  443 [ACK] Seq=1 Ack=1 Win=131392 Len=1428 TSval=878321551 TSecr=3100769184 [TCP PDU reassembled in 202]"
"202","8.510764","192.168.219.118","211.183.210.21","TLSv1.2","177","Client Hello (SNI=katalk.kakao.com)"
"203","8.512337","1.214.68.2","192.168.219.118","DNS","150","Standard query response 0x69c7 HTTPS firebaselogging-pa.googleapis.com SOA ns1.google.com"
"204","8.513362","1.214.68.2","192.168.219.118","DNS","349","Standard query response 0x396a A firebaselogging-pa.googleapis.com A 142.250.197.10 A 142.250.66.42 A 142.250.198.170 A 142.250.199.234 A 142.250.196.234 A 142.250.198.202 A 142.250.199.74 A 142.250.198.138 A 142.250.198.234 A 142.250.198.106 A 142.250.76.10 A 142.250.71.138 A 142.250.71.170 A 142.250.76.234 A 142.250.197.42 A 142.250.199.202"
"205","8.515599","192.168.219.118","142.250.198.202","QUIC","1242","Initial, DCID=036ae240ca812733, PKN: 0, CRYPTO, PADDING"
"206","8.515613","192.168.219.118","142.250.198.202","QUIC","1242","Initial, DCID=036ae240ca812733, PKN: 1, CRYPTO, PADDING"
"207","8.523212","211.183.210.21","192.168.219.118","TCP","66","443  >  54481 [ACK] Seq=1 Ack=1429 Win=45056 Len=0 TSval=3100769197 TSecr=878321551"
"208","8.523214","211.183.210.21","192.168.219.118","TCP","66","443  >  54481 [ACK] Seq=1 Ack=1540 Win=45056 Len=0 TSval=3100769197 TSecr=878321551"
"209","8.527727","211.183.210.21","192.168.219.118","TLSv1.2","1514","Server Hello"
"210","8.527730","211.183.210.21","192.168.219.118","TCP","1514","443  >  54481 [PSH, ACK] Seq=1449 Ack=1540 Win=45056 Len=1448 TSval=3100769200 TSecr=878321551 [TCP PDU reassembled in 211]"
"211","8.527732","211.183.210.21","192.168.219.118","TLSv1.2","1266","Certificate"
"212","8.527734","211.183.210.21","192.168.219.118","TLSv1.2","135","Server Key Exchange, Server Hello Done"
"213","8.527971","192.168.219.118","211.183.210.21","TCP","66","54481  >  443 [ACK] Seq=1540 Ack=4166 Win=127232 Len=0 TSval=878321568 TSecr=3100769200"
"214","8.527972","192.168.219.118","211.183.210.21","TCP","66","[TCP Window Update] 54481  >  443 [ACK] Seq=1540 Ack=4166 Win=131072 Len=0 TSval=878321568 TSecr=3100769200"
"215","8.530511","192.168.219.118","211.183.210.21","TLSv1.2","159","Client Key Exchange, Change Cipher Spec, Encrypted Handshake Message"
"216","8.542674","211.183.210.21","192.168.219.118","TLSv1.2","117","Change Cipher Spec, Encrypted Handshake Message"
"217","8.542943","192.168.219.118","211.183.210.21","TCP","66","54481  >  443 [ACK] Seq=1633 Ack=4217 Win=131072 Len=0 TSval=878321583 TSecr=3100769216"
"218","8.543065","192.168.219.118","211.183.210.21","TLSv1.2","584","Application Data"
"219","8.543144","192.168.219.118","211.183.210.21","TLSv1.2","122","Application Data"
"220","8.555949","211.183.210.21","192.168.219.118","TCP","66","443  >  54481 [ACK] Seq=4217 Ack=2207 Win=45056 Len=0 TSval=3100769230 TSecr=878321583"
"221","8.583334","211.183.210.21","192.168.219.118","TCP","1514","443  >  54481 [ACK] Seq=4217 Ack=2207 Win=45056 Len=1448 TSval=3100769257 TSecr=878321583 [TCP PDU reassembled in 223]"
"222","8.583337","211.183.210.21","192.168.219.118","TCP","1514","443  >  54481 [PSH, ACK] Seq=5665 Ack=2207 Win=45056 Len=1448 TSval=3100769257 TSecr=878321583 [TCP PDU reassembled in 223]"
"223","8.583339","211.183.210.21","192.168.219.118","TLSv1.2","335","Application Data"
"224","8.583466","192.168.219.118","211.183.210.21","TCP","66","54481  >  443 [ACK] Seq=2207 Ack=7382 Win=127936 Len=0 TSval=878321624 TSecr=3100769257"
"225","8.583466","192.168.219.118","211.183.210.21","TCP","66","[TCP Window Update] 54481  >  443 [ACK] Seq=2207 Ack=7382 Win=131072 Len=0 TSval=878321624 TSecr=3100769257"
"226","8.586032","142.250.198.202","192.168.219.118","QUIC","85","Initial, SCID=e36ae240ca812733, PKN: 1, ACK_ECN"
"227","8.588134","142.250.198.202","192.168.219.118","QUIC","1242","Initial, SCID=e36ae240ca812733, PKN: 2, ACK_ECN, PADDING"
"228","8.588136","142.250.198.202","192.168.219.118","QUIC","1242","Initial, SCID=e36ae240ca812733, PKN: 3, CRYPTO, PADDING"
"229","8.588138","142.250.198.202","192.168.219.118","QUIC","1242","Initial, SCID=e36ae240ca812733, PKN: 4, CRYPTO, PADDING"
"230","8.588139","142.250.198.202","192.168.219.118","QUIC","1242","Initial, SCID=e36ae240ca812733, PKN: 5, CRYPTO, PADDING"
"231","8.588400","192.168.219.118","142.250.198.202","QUIC","1242","Initial, DCID=e36ae240ca812733, PKN: 2, ACK, PADDING"
"232","8.595005","192.168.219.118","211.183.210.21","TLSv1.2","552","Application Data"
"233","8.595443","192.168.219.118","1.214.68.2","DNS","82","Standard query 0x548c HTTPS talk-pilsner.kakao.com"
"234","8.595713","192.168.219.118","1.214.68.2","DNS","82","Standard query 0x3b8b A talk-pilsner.kakao.com"
"235","8.597308","192.168.219.118","1.214.68.2","DNS","81","Standard query 0x30ed A ticket-loco.kakao.com"
"236","8.603292","142.250.198.202","192.168.219.118","QUIC","1242","Handshake, SCID=e36ae240ca812733"
"237","8.603293","142.250.198.202","192.168.219.118","QUIC","1242","Handshake, SCID=e36ae240ca812733"
"238","8.603366","192.168.219.118","142.250.198.202","QUIC","81","Handshake, DCID=e36ae240ca812733"
"239","8.607922","1.214.68.2","192.168.219.118","DNS","182","Standard query response 0x548c HTTPS talk-pilsner.kakao.com CNAME talk-pilsner-1bxx2m3t.kgslb.com SOA gsx-gslb01.kakao.com"
"240","8.608465","192.168.219.118","1.214.68.2","DNS","91","Standard query 0x97f2 HTTPS talk-pilsner-1bxx2m3t.kgslb.com"
"241","8.608577","1.214.68.2","192.168.219.118","DNS","154","Standard query response 0x30ed A ticket-loco.kakao.com CNAME ticket-gslb-6z48wmzh.kgns3.com A 211.183.211.10 A 121.53.93.47"
"242","8.608585","1.214.68.2","192.168.219.118","DNS","140","Standard query response 0x3b8b A talk-pilsner.kakao.com CNAME talk-pilsner-1bxx2m3t.kgslb.com A 121.53.203.203"
"243","8.609528","192.168.219.118","211.183.211.10","TCP","78","49653  >  995 [SYN, ECE, CWR] Seq=0 Win=65535 Len=0 MSS=1460 WS=64 TSval=1846495249 TSecr=0 SACK_PERM"
"244","8.609712","192.168.219.118","121.53.203.203","TCP","78","54482  >  443 [SYN, ECE, CWR] Seq=0 Win=65535 Len=0 MSS=1460 WS=64 TSval=325432225 TSecr=0 SACK_PERM"
"245","8.619793","1.214.68.2","192.168.219.118","DNS","155","Standard query response 0x97f2 HTTPS talk-pilsner-1bxx2m3t.kgslb.com SOA gsx-gslb01.kakao.com"
"246","8.622335","211.183.211.10","192.168.219.118","TCP","74","995  >  49653 [SYN, ACK, ECE] Seq=0 Ack=1 Win=2796 Len=0 MSS=1410 SACK_PERM TSval=3625950693 TSecr=1846495249 WS=1"
"247","8.622418","192.168.219.118","211.183.211.10","TCP","66","49653  >  995 [ACK] Seq=1 Ack=1 Win=131456 Len=0 TSval=1846495262 TSecr=3625950693"
"248","8.623013","121.53.203.203","192.168.219.118","TCP","74","443  >  54482 [SYN, ACK, ECE] Seq=0 Ack=1 Win=28960 Len=0 MSS=1440 SACK_PERM TSval=505595415 TSecr=325432225 WS=4096"
"249","8.623209","192.168.219.118","121.53.203.203","TCP","66","54482  >  443 [ACK] Seq=1 Ack=1 Win=131392 Len=0 TSval=325432238 TSecr=505595415"
"250","8.623216","192.168.219.118","121.53.203.203","TCP","1494","54482  >  443 [ACK] Seq=1 Ack=1 Win=131392 Len=1428 TSval=325432239 TSecr=505595415 [TCP PDU reassembled in 251]"
"251","8.623217","192.168.219.118","121.53.203.203","TLSv1.3","183","Client Hello (SNI=talk-pilsner.kakao.com)"
"252","8.623635","192.168.219.118","211.183.211.10","SSL","334","Continuation Data"
"253","8.623927","192.168.219.118","211.183.211.10","TCP","240","49653  >  995 [PSH, ACK] Seq=269 Ack=1 Win=131456 Len=174 TSval=1846495263 TSecr=3625950693"
"254","8.636311","211.183.211.10","192.168.219.118","TCP","66","995  >  49653 [ACK] Seq=1 Ack=269 Win=2796 Len=0 TSval=3625950707 TSecr=1846495263"
"255","8.636312","211.183.211.10","192.168.219.118","TCP","66","995  >  49653 [ACK] Seq=1 Ack=443 Win=2796 Len=0 TSval=3625950707 TSecr=1846495263"
"256","8.636313","121.53.203.203","192.168.219.118","TCP","66","443  >  54482 [ACK] Seq=1 Ack=1546 Win=32768 Len=0 TSval=505595429 TSecr=325432239"
"257","8.637695","121.53.203.203","192.168.219.118","TLSv1.3","1514","Server Hello, Change Cipher Spec"
"258","8.637696","121.53.203.203","192.168.219.118","TCP","1514","443  >  54482 [ACK] Seq=1449 Ack=1546 Win=32768 Len=1448 TSval=505595430 TSecr=325432239 [TCP PDU reassembled in 259]"
"259","8.637697","121.53.203.203","192.168.219.118","TLSv1.3","1396","Application Data"
"260","8.637862","192.168.219.118","121.53.203.203","TCP","66","54482  >  443 [ACK] Seq=1546 Ack=4227 Win=127168 Len=0 TSval=325432253 TSecr=505595430"
"261","8.637862","192.168.219.118","121.53.203.203","TCP","66","[TCP Window Update] 54482  >  443 [ACK] Seq=1546 Ack=4227 Win=131072 Len=0 TSval=325432253 TSecr=505595430"
"262","8.640151","192.168.219.118","121.53.203.203","TLSv1.3","146","Change Cipher Spec, Application Data"
"263","8.640469","192.168.219.118","121.53.203.203","TLSv1.3","689","Application Data"
"264","8.640923","211.183.211.10","192.168.219.118","SSL","412","Continuation Data"
"265","8.640966","192.168.219.118","211.183.211.10","TCP","66","49653  >  995 [ACK] Seq=443 Ack=347 Win=131136 Len=0 TSval=1846495280 TSecr=3625950711"
"266","8.641279","192.168.219.118","211.183.211.10","TCP","66","49653  >  995 [FIN, ACK] Seq=443 Ack=347 Win=131136 Len=0 TSval=1846495281 TSecr=3625950711"
"267","8.641440","192.168.219.118","203.133.190.83","TCP","78","49654  >  995 [SYN, ECE, CWR] Seq=0 Win=65535 Len=0 MSS=1460 WS=64 TSval=3844817773 TSecr=0 SACK_PERM"
"268","8.646774","211.183.210.21","192.168.219.118","TCP","66","443  >  54479 [ACK] Seq=4968 Ack=2831 Win=45056 Len=0 TSval=3124589501 TSecr=2724950452"
"269","8.651986","121.53.203.203","192.168.219.118","TLSv1.3","565","Application Data, Application Data"
"270","8.652053","192.168.219.118","121.53.203.203","TCP","66","54482  >  443 [ACK] Seq=2249 Ack=4726 Win=130624 Len=0 TSval=325432267 TSecr=505595444"
"271","8.652075","192.168.219.118","121.53.203.203","TLSv1.3","97","Application Data"
"272","8.653282","121.53.203.203","192.168.219.118","TLSv1.3","110","Application Data"
"273","8.653316","192.168.219.118","121.53.203.203","TCP","66","54482  >  443 [ACK] Seq=2280 Ack=4770 Win=131072 Len=0 TSval=325432269 TSecr=505595446"
"274","8.653727","203.133.190.83","192.168.219.118","TCP","74","995  >  49654 [SYN, ACK, ECE] Seq=0 Ack=1 Win=1448 Len=0 MSS=1460 SACK_PERM TSval=2651824744 TSecr=3844817773 WS=1"
"275","8.653795","192.168.219.118","203.133.190.83","TCP","66","49654  >  995 [ACK] Seq=1 Ack=1 Win=131776 Len=0 TSval=3844817785 TSecr=2651824744"
"276","8.654638","192.168.219.118","203.133.190.83","SSL","334","Continuation Data"
"277","8.654872","192.168.219.118","203.133.190.83","TCP","482","49654  >  995 [PSH, ACK] Seq=269 Ack=1 Win=131776 Len=416 TSval=3844817786 TSecr=2651824744"
"278","8.654876","211.183.211.10","192.168.219.118","TCP","66","995  >  49653 [FIN, ACK] Seq=347 Ack=444 Win=2796 Len=0 TSval=3625950726 TSecr=1846495281"
"279","8.654906","192.168.219.118","211.183.211.10","TCP","66","49653  >  995 [ACK] Seq=444 Ack=348 Win=131136 Len=0 TSval=1846495294 TSecr=3625950726"
"280","8.657818","121.53.203.203","192.168.219.118","TLSv1.3","891","Application Data"
"281","8.657819","121.53.203.203","192.168.219.118","TLSv1.3","150","Application Data"
"282","8.657820","121.53.203.203","192.168.219.118","TLSv1.3","97","Application Data"
"283","8.657863","192.168.219.118","121.53.203.203","TCP","66","54482  >  443 [ACK] Seq=2280 Ack=5710 Win=130176 Len=0 TSval=325432273 TSecr=505595450"
"284","8.658471","142.250.198.202","192.168.219.118","QUIC","1025","Protected Payload (KP0)"
"285","8.658569","192.168.219.118","142.250.198.202","QUIC","81","Handshake, DCID=e36ae240ca812733"
"286","8.659963","192.168.219.118","142.250.198.202","QUIC","131","Handshake, DCID=e36ae240ca812733"
"287","8.660265","192.168.219.118","142.250.198.202","QUIC","73","Protected Payload (KP0), DCID=e36ae240ca812733"
"288","8.660369","192.168.219.118","142.250.198.202","QUIC","92","Protected Payload (KP0), DCID=e36ae240ca812733"
"289","8.660445","192.168.219.118","142.250.198.202","QUIC","266","Protected Payload (KP0), DCID=e36ae240ca812733"
"290","8.660486","192.168.219.118","142.250.198.202","QUIC","76","Protected Payload (KP0), DCID=e36ae240ca812733"
"291","8.660535","192.168.219.118","142.250.198.202","QUIC","694","Protected Payload (KP0), DCID=e36ae240ca812733"
"292","8.665964","203.133.190.83","192.168.219.118","TCP","66","995  >  49654 [ACK] Seq=1 Ack=269 Win=1448 Len=0 TSval=2651824757 TSecr=3844817786"
"293","8.665965","203.133.190.83","192.168.219.118","TCP","66","995  >  49654 [ACK] Seq=1 Ack=685 Win=1448 Len=0 TSval=2651824757 TSecr=3844817786"
"294","8.673310","211.183.210.21","192.168.219.118","TCP","1514","443  >  54479 [ACK] Seq=4968 Ack=2831 Win=45056 Len=1448 TSval=3124589527 TSecr=2724950452 [TCP PDU reassembled in 295]"
"295","8.673311","211.183.210.21","192.168.219.118","TLSv1.2","109","Application Data"
"296","8.673404","192.168.219.118","211.183.210.21","TCP","66","54479  >  443 [ACK] Seq=2831 Ack=6459 Win=129600 Len=0 TSval=2724950531 TSecr=3124589527"
"297","8.674623","211.183.210.21","192.168.219.118","TCP","1514","443  >  54479 [ACK] Seq=6459 Ack=2831 Win=45056 Len=1448 TSval=3124589527 TSecr=2724950452 [TCP PDU reassembled in 299]"
"298","8.674625","211.183.210.21","192.168.219.118","TCP","1514","443  >  54479 [PSH, ACK] Seq=7907 Ack=2831 Win=45056 Len=1448 TSval=3124589527 TSecr=2724950452 [TCP PDU reassembled in 299]"
"299","8.674626","211.183.210.21","192.168.219.118","TLSv1.2","1295","Application Data"
"300","8.674627","211.183.210.21","192.168.219.118","TCP","1514","443  >  54479 [ACK] Seq=10584 Ack=2831 Win=45056 Len=1448 TSval=3124589527 TSecr=2724950452 [TCP PDU reassembled in 302]"
"301","8.674628","211.183.210.21","192.168.219.118","TCP","1514","443  >  54479 [PSH, ACK] Seq=12032 Ack=2831 Win=45056 Len=1448 TSval=3124589527 TSecr=2724950452 [TCP PDU reassembled in 302]"
"302","8.674629","211.183.210.21","192.168.219.118","TLSv1.2","1295","Application Data"
"303","8.674631","211.183.210.21","192.168.219.118","TCP","1514","443  >  54479 [ACK] Seq=14709 Ack=2831 Win=45056 Len=1448 TSval=3124589527 TSecr=2724950452 [TCP PDU reassembled in 319]"
"304","8.674632","211.183.210.21","192.168.219.118","TCP","1514","443  >  54479 [PSH, ACK] Seq=16157 Ack=2831 Win=45056 Len=1448 TSval=3124589527 TSecr=2724950452 [TCP PDU reassembled in 319]"
"305","8.674672","192.168.219.118","211.183.210.21","TCP","66","54479  >  443 [ACK] Seq=2831 Ack=17605 Win=119936 Len=0 TSval=2724950532 TSecr=3124589527"
"306","8.674672","192.168.219.118","211.183.210.21","TCP","66","[TCP Window Update] 54479  >  443 [ACK] Seq=2831 Ack=17605 Win=131072 Len=0 TSval=2724950532 TSecr=3124589527"
"307","8.682522","121.53.203.203","192.168.219.118","TLSv1.3","801","Application Data"
"308","8.682525","121.53.203.203","192.168.219.118","TCP","1514","443  >  54482 [ACK] Seq=6445 Ack=2280 Win=36864 Len=1448 TSval=505595473 TSecr=325432267 [TCP PDU reassembled in 310]"
"309","8.682527","121.53.203.203","192.168.219.118","TCP","1514","443  >  54482 [ACK] Seq=7893 Ack=2280 Win=36864 Len=1448 TSval=505595473 TSecr=325432267 [TCP PDU reassembled in 310]"
"310","8.682531","121.53.203.203","192.168.219.118","TLSv1.3","1148","Application Data"
"311","8.682534","121.53.203.203","192.168.219.118","TCP","1514","443  >  54482 [ACK] Seq=10423 Ack=2280 Win=36864 Len=1448 TSval=505595473 TSecr=325432267 [TCP PDU reassembled in 313]"
"312","8.682538","121.53.203.203","192.168.219.118","TCP","1514","443  >  54482 [ACK] Seq=11871 Ack=2280 Win=36864 Len=1448 TSval=505595473 TSecr=325432267 [TCP PDU reassembled in 313]"
"313","8.682541","121.53.203.203","192.168.219.118","TLSv1.3","1297","Application Data"
"314","8.682544","121.53.203.203","192.168.219.118","TCP","1514","443  >  54482 [ACK] Seq=14550 Ack=2280 Win=36864 Len=1448 TSval=505595473 TSecr=325432267 [TCP PDU reassembled in 323]"
"315","8.682548","121.53.203.203","192.168.219.118","TCP","1514","443  >  54482 [ACK] Seq=15998 Ack=2280 Win=36864 Len=1448 TSval=505595473 TSecr=325432267 [TCP PDU reassembled in 323]"
"316","8.682550","121.53.203.203","192.168.219.118","TCP","1514","443  >  54482 [ACK] Seq=17446 Ack=2280 Win=36864 Len=1448 TSval=505595473 TSecr=325432267 [TCP PDU reassembled in 323]"
"317","8.682750","192.168.219.118","121.53.203.203","TCP","66","54482  >  443 [ACK] Seq=2280 Ack=18894 Win=117888 Len=0 TSval=325432298 TSecr=505595473"
