"No.","Time","Source","Destination","Protocol","Length","Info"
"1","0.000000","1.214.68.2","192.168.219.118","DNS","100","Standard query response 0x6d36 A www.googleadservices.com A 142.250.197.226"
"2","0.000001","1.214.68.2","192.168.219.118","DNS","109","Standard query response 0xdd78 HTTPS www.googleadservices.com HTTPS"
"3","0.001236","192.168.219.118","142.250.197.226","QUIC","1292","Initial, DCID=8116e3ea6b97ad20, PKN: 1, PING, CRYPTO, CRYPTO, PING, PADDING, CRYPTO, PING, PING, PING, PING, PING, CRYPTO, CRYPTO, CRYPTO, CRYPTO, CRYPTO, CRYPTO, PADDING, CRYPTO, CRYPTO, PING, CRYPTO, PING"
"4","0.001274","192.168.219.118","142.250.197.226","QUIC","1292","Initial, DCID=8116e3ea6b97ad20, PKN: 2, CRYPTO, PADDING, CRYPTO, PING, PADDING, PING, CRYPTO, CRYPTO, PING, PING, PADDING, CRYPTO, CRYPTO, PADDING, PING, PING, PADDING, CRYPTO, CRYPTO, CRYPTO, PING, PING, PING, CRYPTO, CRYPTO"
"5","0.003862","192.168.219.118","1.214.68.2","DNS","84","Standard query 0xc246 HTTPS www.googleadservices.com"
"6","0.003998","192.168.219.118","1.214.68.2","DNS","84","Standard query 0xfee3 A www.googleadservices.com"
"7","0.014542","1.214.68.2","192.168.219.118","DNS","109","Standard query response 0xc246 HTTPS www.googleadservices.com HTTPS"
"8","0.014543","1.214.68.2","192.168.219.118","DNS","100","Standard query response 0xfee3 A www.googleadservices.com A 142.250.198.130"
"9","0.015673","192.168.219.118","142.250.198.130","QUIC","1292","Initial, DCID=6d83e04a7cf9f698, PKN: 1, PING, PING, PADDING, CRYPTO, PING, PING, PING, CRYPTO, PING, CRYPTO, PING, PADDING, CRYPTO, CRYPTO, CRYPTO, PADDING, CRYPTO, CRYPTO"
"10","0.015712","192.168.219.118","142.250.198.130","QUIC","1292","Initial, DCID=6d83e04a7cf9f698, PKN: 2, PADDING, CRYPTO, PING, PADDING, CRYPTO, CRYPTO, CRYPTO, CRYPTO, PING, PADDING, PING, PADDING, PING, PING, PING, PING, CRYPTO, CRYPTO, PADDING, PING, CRYPTO, PING, PING, CRYPTO"
"11","0.019277","192.168.219.118","1.214.68.2","DNS","84","Standard query 0xb6e4 HTTPS www.googleadservices.com"
"12","0.019442","192.168.219.118","1.214.68.2","DNS","84","Standard query 0xbc03 A www.googleadservices.com"
"13","0.032327","1.214.68.2","192.168.219.118","DNS","109","Standard query response 0xb6e4 HTTPS www.googleadservices.com HTTPS"
"14","0.034095","1.214.68.2","192.168.219.118","DNS","100","Standard query response 0xbc03 A www.googleadservices.com A 142.250.197.34"
"15","0.034986","192.168.219.118","142.250.197.34","QUIC","1292","Initial, DCID=1421135a55d28dbf, PKN: 1, CRYPTO, PADDING, CRYPTO, PADDING, CRYPTO, PING, PADDING, CRYPTO, PADDING, CRYPTO, CRYPTO, CRYPTO, PING, PADDING, PING, CRYPTO, PADDING, CRYPTO, PADDING, PING, PADDING, PING, CRYPTO, CRYPTO"
"16","0.035020","192.168.219.118","142.250.197.34","QUIC","1292","Initial, DCID=1421135a55d28dbf, PKN: 2, CRYPTO, CRYPTO, PADDING, PING, PING, PING, PADDING, CRYPTO, PADDING, CRYPTO, PADDING, CRYPTO, PING, PING, PADDING"
"17","0.079594","142.250.197.226","192.168.219.118","QUIC","82","Initial, SCID=e116e3ea6b97ad20, PKN: 1, ACK"
"18","0.080413","142.250.197.226","192.168.219.118","QUIC","1292","Initial, SCID=e116e3ea6b97ad20, PKN: 2, ACK, PADDING"
"19","0.080414","142.250.197.226","192.168.219.118","QUIC","1292","Initial, SCID=e116e3ea6b97ad20, PKN: 3, CRYPTO, PADDING"
"20","0.080416","142.250.197.226","192.168.219.118","QUIC","1292","Initial, SCID=e116e3ea6b97ad20, PKN: 4, CRYPTO, PADDING"
"21","0.081047","192.168.219.118","142.250.197.226","QUIC","1292","Initial, DCID=e116e3ea6b97ad20, PKN: 3, ACK, PADDING"
"22","0.082638","142.250.198.130","192.168.219.118","QUIC","82","Initial, SCID=ed83e04a7cf9f698, PKN: 1, ACK"
"23","0.083374","142.250.198.130","192.168.219.118","QUIC","1292","Initial, SCID=ed83e04a7cf9f698, PKN: 2, ACK, PADDING"
"24","0.083376","142.250.198.130","192.168.219.118","QUIC","1292","Initial, SCID=ed83e04a7cf9f698, PKN: 3, CRYPTO, PADDING"
"25","0.083377","142.250.198.130","192.168.219.118","QUIC","1292","Initial, SCID=ed83e04a7cf9f698, PKN: 4, CRYPTO, PADDING"
"26","0.083913","192.168.219.118","142.250.198.130","QUIC","1292","Initial, DCID=ed83e04a7cf9f698, PKN: 3, ACK, PADDING"
"27","0.095385","142.250.198.130","192.168.219.118","QUIC","1292","Handshake, SCID=ed83e04a7cf9f698"
"28","0.095386","142.250.198.130","192.168.219.118","QUIC","1191","Protected Payload (KP0)"
"29","0.096254","192.168.219.118","142.250.198.130","QUIC","82","Handshake, DCID=ed83e04a7cf9f698"
"30","0.096291","192.168.219.118","142.250.198.130","QUIC","203","Protected Payload (KP0), DCID=ed83e04a7cf9f698"
"31","0.096368","142.250.197.226","192.168.219.118","QUIC","1292","Handshake, SCID=e116e3ea6b97ad20"
"32","0.096369","142.250.197.226","192.168.219.118","QUIC","1178","Protected Payload (KP0)"
"33","0.096491","192.168.219.118","142.250.198.130","QUIC","1288","Protected Payload (KP0), DCID=ed83e04a7cf9f698"
"34","0.096513","192.168.219.118","142.250.198.130","QUIC","1292","Protected Payload (KP0), DCID=ed83e04a7cf9f698"
"35","0.096532","192.168.219.118","142.250.198.130","QUIC","998","Protected Payload (KP0), DCID=ed83e04a7cf9f698"
"36","0.097240","192.168.219.118","142.250.197.226","QUIC","82","Handshake, DCID=e116e3ea6b97ad20"
"37","0.097270","192.168.219.118","142.250.197.226","QUIC","204","Protected Payload (KP0), DCID=e116e3ea6b97ad20"
"38","0.097404","192.168.219.118","142.250.197.226","QUIC","1288","Protected Payload (KP0), DCID=e116e3ea6b97ad20"
"39","0.097429","192.168.219.118","142.250.197.226","QUIC","1292","Protected Payload (KP0), DCID=e116e3ea6b97ad20"
"40","0.097448","192.168.219.118","142.250.197.226","QUIC","998","Protected Payload (KP0), DCID=e116e3ea6b97ad20"
"41","0.103488","142.250.197.34","192.168.219.118","QUIC","82","Initial, SCID=f421135a55d28dbf, PKN: 1, ACK"
"42","0.103831","142.250.197.34","192.168.219.118","QUIC","1292","Initial, SCID=f421135a55d28dbf, PKN: 2, ACK, PADDING"
"43","0.103832","142.250.197.34","192.168.219.118","QUIC","1292","Initial, SCID=f421135a55d28dbf, PKN: 3, CRYPTO, PADDING"
"44","0.103833","142.250.197.34","192.168.219.118","QUIC","1292","Initial, SCID=f421135a55d28dbf, PKN: 4, CRYPTO, PADDING"
"45","0.104302","192.168.219.118","142.250.197.34","QUIC","1292","Initial, DCID=f421135a55d28dbf, PKN: 3, ACK, PADDING"
"46","0.116160","142.250.197.34","192.168.219.118","QUIC","1292","Handshake, SCID=f421135a55d28dbf"
"47","0.116163","142.250.197.34","192.168.219.118","QUIC","1188","Protected Payload (KP0)"
"48","0.117712","192.168.219.118","142.250.197.34","QUIC","82","Handshake, DCID=f421135a55d28dbf"
"49","0.117741","192.168.219.118","142.250.197.34","QUIC","205","Protected Payload (KP0), DCID=f421135a55d28dbf"
"50","0.118024","192.168.219.118","142.250.197.34","QUIC","1288","Protected Payload (KP0), DCID=f421135a55d28dbf"
"51","0.118037","192.168.219.118","142.250.197.34","QUIC","934","Protected Payload (KP0), DCID=f421135a55d28dbf"
"52","0.162769","142.250.198.130","192.168.219.118","QUIC","1005","Protected Payload (KP0)"
"53","0.162770","142.250.198.130","192.168.219.118","QUIC","163","Protected Payload (KP0)"
"54","0.163177","192.168.219.118","142.250.198.130","QUIC","74","Protected Payload (KP0), DCID=ed83e04a7cf9f698"
"55","0.163797","142.250.198.130","192.168.219.118","QUIC","69","Protected Payload (KP0)"
"56","0.163800","142.250.198.130","192.168.219.118","QUIC","65","Protected Payload (KP0)"
"57","0.175430","142.250.197.226","192.168.219.118","QUIC","1005","Protected Payload (KP0)"
"58","0.175431","142.250.197.226","192.168.219.118","QUIC","163","Protected Payload (KP0)"
"59","0.175578","192.168.219.118","142.250.197.226","QUIC","74","Protected Payload (KP0), DCID=e116e3ea6b97ad20"
"60","0.176192","142.250.197.226","192.168.219.118","QUIC","69","Protected Payload (KP0)"
"61","0.176193","142.250.197.226","192.168.219.118","QUIC","65","Protected Payload (KP0)"
"62","0.177924","142.250.198.130","192.168.219.118","QUIC","302","Protected Payload (KP0)"
"63","0.177926","142.250.198.130","192.168.219.118","QUIC","63","Protected Payload (KP0)"
"64","0.178136","192.168.219.118","142.250.198.130","QUIC","77","Protected Payload (KP0), DCID=ed83e04a7cf9f698"
"65","0.186506","142.250.197.34","192.168.219.118","QUIC","1005","Protected Payload (KP0)"
"66","0.186507","142.250.197.34","192.168.219.118","QUIC","163","Protected Payload (KP0)"
"67","0.186695","192.168.219.118","142.250.197.34","QUIC","74","Protected Payload (KP0), DCID=f421135a55d28dbf"
"68","0.187424","142.250.197.34","192.168.219.118","QUIC","69","Protected Payload (KP0)"
"69","0.195401","142.250.197.226","192.168.219.118","QUIC","302","Protected Payload (KP0)"
"70","0.195403","142.250.197.226","192.168.219.118","QUIC","63","Protected Payload (KP0)"
"71","0.195669","192.168.219.118","142.250.197.226","QUIC","77","Protected Payload (KP0), DCID=e116e3ea6b97ad20"
"72","0.203940","192.168.219.118","142.250.198.130","QUIC","74","Protected Payload (KP0), DCID=ed83e04a7cf9f698"
"73","0.209263","142.250.197.34","192.168.219.118","QUIC","308","Protected Payload (KP0)"
"74","0.209265","142.250.197.34","192.168.219.118","QUIC","63","Protected Payload (KP0)"
"75","0.209614","192.168.219.118","142.250.197.34","QUIC","77","Protected Payload (KP0), DCID=f421135a55d28dbf"
"76","0.221538","192.168.219.118","142.250.197.226","QUIC","74","Protected Payload (KP0), DCID=e116e3ea6b97ad20"
"77","0.236728","192.168.219.118","142.250.197.34","QUIC","74","Protected Payload (KP0), DCID=f421135a55d28dbf"
"78","0.268862","142.250.198.130","192.168.219.118","QUIC","66","Protected Payload (KP0)"
"79","0.299165","142.250.197.226","192.168.219.118","QUIC","66","Protected Payload (KP0)"
"80","0.302694","142.250.197.34","192.168.219.118","QUIC","66","Protected Payload (KP0)"
"81","0.391403","162.19.138.83","192.168.219.118","TLSv1.2","105","Application Data"
"82","0.391404","162.19.138.83","192.168.219.118","TLSv1.2","90","Application Data"
"83","0.391406","162.19.138.83","192.168.219.118","TCP","66","443  >  49781 [FIN, ACK] Seq=64 Ack=1 Win=83 Len=0 TSval=2569597218 TSecr=345452332"
"84","0.391503","192.168.219.118","162.19.138.83","TCP","66","49781  >  443 [ACK] Seq=1 Ack=64 Win=2048 Len=0 TSval=345458331 TSecr=2569597218"
"85","0.391538","192.168.219.118","162.19.138.83","TCP","66","49781  >  443 [ACK] Seq=1 Ack=65 Win=2048 Len=0 TSval=345458331 TSecr=2569597218"
"86","0.391712","192.168.219.118","162.19.138.83","TCP","66","49781  >  443 [FIN, ACK] Seq=1 Ack=65 Win=2048 Len=0 TSval=345458331 TSecr=2569597218"
"87","0.530427","34.196.207.83","192.168.219.118","TLSv1.2","97","Encrypted Alert"
"88","0.530498","192.168.219.118","34.196.207.83","TCP","66","49820  >  443 [ACK] Seq=1 Ack=32 Win=2048 Len=0 TSval=826144723 TSecr=4173843240"
"89","0.683643","162.19.138.83","192.168.219.118","TCP","66","443  >  49781 [ACK] Seq=65 Ack=2 Win=83 Len=0 TSval=2569597510 TSecr=345458331"
"90","0.685989","162.19.138.83","192.168.219.118","TLSv1.2","90","Application Data"
"91","0.685991","162.19.138.83","192.168.219.118","TCP","66","443  >  49796 [FIN, ACK] Seq=25 Ack=1 Win=83 Len=0 TSval=2569597498 TSecr=14910134"
"92","0.686104","192.168.219.118","162.19.138.83","TCP","66","49796  >  443 [ACK] Seq=1 Ack=25 Win=2048 Len=0 TSval=14916132 TSecr=2569597498"
"93","0.686161","192.168.219.118","162.19.138.83","TCP","66","49796  >  443 [ACK] Seq=1 Ack=26 Win=2048 Len=0 TSval=14916132 TSecr=2569597498"
"94","1.150030","50.116.239.135","192.168.219.118","TLSv1.2","105","Application Data"
"95","1.150032","50.116.239.135","192.168.219.118","TLSv1.2","90","Application Data"
"96","1.150034","50.116.239.135","192.168.219.118","TCP","66","443  >  49827 [FIN, ACK] Seq=64 Ack=1 Win=35 Len=0 TSval=2022443373 TSecr=1279789900"
"97","1.150197","192.168.219.118","50.116.239.135","TCP","66","49827  >  443 [ACK] Seq=1 Ack=64 Win=2048 Len=0 TSval=1279796952 TSecr=2022443373"
"98","1.150269","192.168.219.118","50.116.239.135","TCP","66","49827  >  443 [ACK] Seq=1 Ack=65 Win=2048 Len=0 TSval=1279796952 TSecr=2022443373"
"99","1.150584","192.168.219.118","50.116.239.135","TCP","66","49827  >  443 [FIN, ACK] Seq=1 Ack=65 Win=2048 Len=0 TSval=1279796953 TSecr=2022443373"
"100","1.196361","50.116.239.135","192.168.219.118","TCP","66","443  >  49827 [ACK] Seq=65 Ack=2 Win=35 Len=0 TSval=2022443429 TSecr=1279796953"
"101","1.314724","182.161.74.19","192.168.219.118","TLSv1.2","105","Application Data"
"102","1.314878","192.168.219.118","182.161.74.19","TCP","66","49744  >  443 [ACK] Seq=1 Ack=40 Win=2048 Len=0 TSval=252153628 TSecr=3937519765"
"103","1.315255","192.168.219.118","182.161.74.19","TCP","66","49744  >  443 [FIN, ACK] Seq=1 Ack=40 Win=2048 Len=0 TSval=252153628 TSecr=3937519765"
"104","1.362068","182.161.74.19","192.168.219.118","TLSv1.2","90","Application Data"
"105","1.362071","182.161.74.19","192.168.219.118","TCP","66","443  >  49744 [FIN, ACK] Seq=64 Ack=2 Win=71 Len=0 TSval=3937519812 TSecr=252153628"
"106","1.362244","192.168.219.118","182.161.74.19","TCP","54","49744  >  443 [RST] Seq=2 Win=0 Len=0"
"107","1.456987","182.161.74.19","192.168.219.118","TLSv1.2","105","Application Data"
"108","1.457113","192.168.219.118","182.161.74.19","TCP","66","49746  >  443 [ACK] Seq=1 Ack=40 Win=2048 Len=0 TSval=2587589794 TSecr=4288208686"
"109","1.457436","192.168.219.118","182.161.74.19","TCP","66","49746  >  443 [FIN, ACK] Seq=1 Ack=40 Win=2048 Len=0 TSval=2587589794 TSecr=4288208686"
"110","1.503218","182.161.74.19","192.168.219.118","TLSv1.2","90","Application Data"
"111","1.503220","182.161.74.19","192.168.219.118","TCP","66","443  >  49746 [FIN, ACK] Seq=64 Ack=2 Win=70 Len=0 TSval=4288208732 TSecr=2587589794"
"112","1.503415","192.168.219.118","182.161.74.19","TCP","54","49746  >  443 [RST] Seq=2 Win=0 Len=0"
"113","1.620774","162.19.138.83","192.168.219.118","TLSv1.2","105","Application Data"
"114","1.620779","162.19.138.83","192.168.219.118","TLSv1.2","90","Application Data"
"115","1.620781","162.19.138.83","192.168.219.118","TCP","66","443  >  49768 [FIN, ACK] Seq=64 Ack=1 Win=83 Len=0 TSval=2569598436 TSecr=461492494"
"116","1.620921","192.168.219.118","162.19.138.83","TCP","66","49768  >  443 [ACK] Seq=1 Ack=64 Win=2048 Len=0 TSval=461498661 TSecr=2569598436"
"117","1.620992","192.168.219.118","162.19.138.83","TCP","66","49768  >  443 [ACK] Seq=1 Ack=65 Win=2048 Len=0 TSval=461498661 TSecr=2569598436"
"118","1.621380","192.168.219.118","162.19.138.83","TCP","66","49768  >  443 [FIN, ACK] Seq=1 Ack=65 Win=2048 Len=0 TSval=461498661 TSecr=2569598436"
"119","1.968969","162.19.138.83","192.168.219.118","TCP","54","443  >  49768 [RST] Seq=65 Win=0 Len=0"
"120","2.378794","103.43.90.21","192.168.219.118","TLSv1.2","112","Application Data"
"121","2.378797","103.43.90.21","192.168.219.118","TLSv1.2","97","Encrypted Alert"
"122","2.378799","103.43.90.21","192.168.219.118","TCP","66","443  >  49761 [FIN, ACK] Seq=78 Ack=1 Win=83 Len=0 TSval=3908414773 TSecr=480057856"
"123","2.378960","192.168.219.118","103.43.90.21","TCP","66","49761  >  443 [ACK] Seq=1 Ack=78 Win=2047 Len=0 TSval=480067872 TSecr=3908414773"
"124","2.379035","192.168.219.118","103.43.90.21","TCP","66","49761  >  443 [ACK] Seq=1 Ack=79 Win=2047 Len=0 TSval=480067872 TSecr=3908414773"
"125","2.379416","192.168.219.118","103.43.90.21","TCP","66","49761  >  443 [FIN, ACK] Seq=1 Ack=79 Win=2048 Len=0 TSval=480067872 TSecr=3908414773"
"126","2.479749","103.43.90.21","192.168.219.118","TCP","66","443  >  49761 [ACK] Seq=79 Ack=2 Win=83 Len=0 TSval=3908414890 TSecr=480067872"
"127","3.710071","182.161.74.47","192.168.219.118","TLSv1.2","105","Application Data"
"128","3.710247","192.168.219.118","182.161.74.47","TCP","66","49776  >  443 [ACK] Seq=1 Ack=40 Win=2048 Len=0 TSval=2731467597 TSecr=580799223"
"129","3.710646","192.168.219.118","182.161.74.47","TCP","66","49776  >  443 [FIN, ACK] Seq=1 Ack=40 Win=2048 Len=0 TSval=2731467598 TSecr=580799223"
"130","3.755917","182.161.74.47","192.168.219.118","TCP","66","[TCP Previous segment not captured] 443  >  49776 [FIN, ACK] Seq=64 Ack=2 Win=71 Len=0 TSval=580799373 TSecr=2731467598"
"131","3.755920","182.161.74.47","192.168.219.118","TCP","90","[TCP Retransmission] 443  >  49776 [PSH, ACK] Seq=40 Ack=2 Win=71 Len=24 TSval=580799373 TSecr=2731467598"
"132","3.756048","192.168.219.118","182.161.74.47","TCP","78","[TCP Dup ACK 128#1] 49776  >  443 [ACK] Seq=2 Ack=40 Win=2048 Len=0 TSval=2731467643 TSecr=580799223 SLE=64 SRE=65"
"133","3.756183","192.168.219.118","182.161.74.47","TCP","54","49776  >  443 [RST] Seq=2 Win=0 Len=0"
"134","3.801105","182.161.74.47","192.168.219.118","TCP","54","443  >  49776 [RST] Seq=40 Win=0 Len=0"
"135","4.122126","23.106.50.37","192.168.219.118","TLSv1.2","105","Application Data"
"136","4.122128","23.106.50.37","192.168.219.118","TLSv1.2","90","Application Data"
"137","4.122130","23.106.50.37","192.168.219.118","TCP","66","443  >  49803 [FIN, ACK] Seq=64 Ack=1 Win=564 Len=0 TSval=3610094209 TSecr=240935539"
"138","4.122134","182.161.74.33","192.168.219.118","TLSv1.2","105","Application Data"
"139","4.122309","192.168.219.118","23.106.50.37","TCP","66","49803  >  443 [ACK] Seq=1 Ack=64 Win=2048 Len=0 TSval=240945636 TSecr=3610094209"
"140","4.122372","192.168.219.118","23.106.50.37","TCP","66","49803  >  443 [ACK] Seq=1 Ack=65 Win=2048 Len=0 TSval=240945636 TSecr=3610094209"
"141","4.122398","192.168.219.118","182.161.74.33","TCP","66","49829  >  443 [ACK] Seq=1 Ack=40 Win=2048 Len=0 TSval=1393153603 TSecr=4254838745"
"142","4.122790","192.168.219.118","23.106.50.37","TCP","66","49803  >  443 [FIN, ACK] Seq=1 Ack=65 Win=2048 Len=0 TSval=240945637 TSecr=3610094209"
"143","4.122999","192.168.219.118","182.161.74.33","TCP","66","49829  >  443 [FIN, ACK] Seq=1 Ack=40 Win=2048 Len=0 TSval=1393153604 TSecr=4254838745"
"144","4.168611","182.161.74.33","192.168.219.118","TLSv1.2","90","Application Data"
"145","4.168613","182.161.74.33","192.168.219.118","TCP","66","443  >  49829 [FIN, ACK] Seq=64 Ack=2 Win=73 Len=0 TSval=4254838801 TSecr=1393153604"
"146","4.168814","192.168.219.118","182.161.74.33","TCP","54","49829  >  443 [RST] Seq=2 Win=0 Len=0"
"147","4.193549","23.106.50.37","192.168.219.118","TCP","66","[TCP Retransmission] 443  >  49803 [FIN, ACK] Seq=64 Ack=1 Win=564 Len=0 TSval=3610094376 TSecr=240935539"
"148","4.193694","192.168.219.118","23.106.50.37","TCP","66","[TCP Retransmission] 49803  >  443 [FIN, ACK] Seq=1 Ack=65 Win=2048 Len=0 TSval=240945708 TSecr=3610094209"
"149","4.202772","23.106.50.37","192.168.219.118","TCP","66","443  >  49803 [ACK] Seq=65 Ack=2 Win=564 Len=0 TSval=3610094385 TSecr=240945637"
"150","4.245896","216.22.16.4","192.168.219.118","TLSv1.2","105","Application Data"
"151","4.245898","216.22.16.4","192.168.219.118","TLSv1.2","90","Application Data"
"152","4.245900","216.22.16.4","192.168.219.118","TCP","66","443  >  49794 [FIN, ACK] Seq=64 Ack=1 Win=585 Len=0 TSval=2126377589 TSecr=1783891078"
"153","4.246009","192.168.219.118","216.22.16.4","TCP","66","49794  >  443 [ACK] Seq=1 Ack=64 Win=2048 Len=0 TSval=1783901078 TSecr=2126377589"
"154","4.246059","192.168.219.118","216.22.16.4","TCP","66","49794  >  443 [ACK] Seq=1 Ack=65 Win=2048 Len=0 TSval=1783901078 TSecr=2126377589"
"155","4.246387","192.168.219.118","216.22.16.4","TCP","66","49794  >  443 [FIN, ACK] Seq=1 Ack=65 Win=2048 Len=0 TSval=1783901078 TSecr=2126377589"
"156","4.267972","182.161.74.47","192.168.219.118","TLSv1.2","105","Application Data"
"157","4.268100","192.168.219.118","182.161.74.47","TCP","66","49857  >  443 [ACK] Seq=1 Ack=40 Win=2048 Len=0 TSval=1740336790 TSecr=1116236785"
"158","4.268382","192.168.219.118","182.161.74.47","TCP","66","49857  >  443 [FIN, ACK] Seq=1 Ack=40 Win=2048 Len=0 TSval=1740336790 TSecr=1116236785"
"159","4.271570","182.161.74.48","192.168.219.118","TLSv1.2","105","Application Data"
"160","4.271571","182.161.74.14","192.168.219.118","TLSv1.2","105","Application Data"
"161","4.271642","192.168.219.118","182.161.74.48","TCP","66","49864  >  443 [ACK] Seq=1 Ack=40 Win=2048 Len=0 TSval=1406510588 TSecr=3946533612"
"162","4.271676","192.168.219.118","182.161.74.14","TCP","66","49863  >  443 [ACK] Seq=1 Ack=40 Win=2048 Len=0 TSval=2367408250 TSecr=2815234634"
"163","4.271819","192.168.219.118","182.161.74.48","TCP","66","49864  >  443 [FIN, ACK] Seq=1 Ack=40 Win=2048 Len=0 TSval=1406510588 TSecr=3946533612"
"164","4.271949","192.168.219.118","182.161.74.14","TCP","66","49863  >  443 [FIN, ACK] Seq=1 Ack=40 Win=2048 Len=0 TSval=2367408250 TSecr=2815234634"
"165","4.272152","182.161.74.50","192.168.219.118","TLSv1.2","105","Application Data"
"166","4.272194","192.168.219.118","182.161.74.50","TCP","66","49862  >  443 [ACK] Seq=1 Ack=40 Win=2048 Len=0 TSval=3530274647 TSecr=896369959"
"167","4.272268","192.168.219.118","182.161.74.50","TCP","66","49862  >  443 [FIN, ACK] Seq=1 Ack=40 Win=2048 Len=0 TSval=3530274647 TSecr=896369959"
"168","4.273117","23.106.50.37","192.168.219.118","TCP","66","[TCP Dup ACK 149#1] 443  >  49803 [ACK] Seq=65 Ack=2 Win=564 Len=0 TSval=3610094455 TSecr=240945637"
"169","4.273151","192.168.219.118","23.106.50.37","TCP","54","49803  >  443 [RST] Seq=2 Win=0 Len=0"
"170","4.314146","182.161.74.47","192.168.219.118","TLSv1.2","90","Application Data"
"171","4.314148","182.161.74.47","192.168.219.118","TCP","66","443  >  49857 [FIN, ACK] Seq=64 Ack=2 Win=70 Len=0 TSval=1116236831 TSecr=1740336790"
"172","4.314343","192.168.219.118","182.161.74.47","TCP","54","49857  >  443 [RST] Seq=2 Win=0 Len=0"
"173","4.317086","182.161.74.48","192.168.219.118","TLSv1.2","90","Application Data"
"174","4.317088","182.161.74.48","192.168.219.118","TCP","66","443  >  49864 [FIN, ACK] Seq=64 Ack=2 Win=70 Len=0 TSval=3946533657 TSecr=1406510588"
"175","4.317173","192.168.219.118","182.161.74.48","TCP","54","49864  >  443 [RST] Seq=2 Win=0 Len=0"
"176","4.317792","182.161.74.14","192.168.219.118","TCP","66","[TCP Previous segment not captured] 443  >  49863 [FIN, ACK] Seq=64 Ack=2 Win=70 Len=0 TSval=2815234680 TSecr=2367408250"
"177","4.317795","182.161.74.14","192.168.219.118","TCP","90","[TCP Retransmission] 443  >  49863 [PSH, ACK] Seq=40 Ack=2 Win=70 Len=24 TSval=2815234680 TSecr=2367408250"
"178","4.317797","182.161.74.50","192.168.219.118","TCP","66","[TCP Previous segment not captured] 443  >  49862 [FIN, ACK] Seq=64 Ack=2 Win=73 Len=0 TSval=896370004 TSecr=3530274647"
"179","4.317799","182.161.74.50","192.168.219.118","TCP","90","[TCP Retransmission] 443  >  49862 [PSH, ACK] Seq=40 Ack=2 Win=73 Len=24 TSval=896370004 TSecr=3530274647"
"180","4.317870","192.168.219.118","182.161.74.14","TCP","78","[TCP Dup ACK 162#1] 49863  >  443 [ACK] Seq=2 Ack=40 Win=2048 Len=0 TSval=2367408296 TSecr=2815234634 SLE=64 SRE=65"
"181","4.317927","192.168.219.118","182.161.74.14","TCP","54","49863  >  443 [RST] Seq=2 Win=0 Len=0"
"182","4.317949","192.168.219.118","182.161.74.50","TCP","78","[TCP Dup ACK 166#1] 49862  >  443 [ACK] Seq=2 Ack=40 Win=2048 Len=0 TSval=3530274693 TSecr=896369959 SLE=64 SRE=65"
"183","4.317975","192.168.219.118","182.161.74.50","TCP","54","49862  >  443 [RST] Seq=2 Win=0 Len=0"
"184","4.324018","182.161.74.8","192.168.219.118","TLSv1.2","105","Application Data"
"185","4.324268","192.168.219.118","182.161.74.8","TCP","66","49861  >  443 [ACK] Seq=1 Ack=40 Win=2343 Len=0 TSval=3306447163 TSecr=3238358530"
"186","4.324629","192.168.219.118","182.161.74.8","TCP","66","49861  >  443 [FIN, ACK] Seq=1 Ack=40 Win=2343 Len=0 TSval=3306447164 TSecr=3238358530"
"187","4.371156","182.161.74.8","192.168.219.118","TLSv1.2","90","Application Data"
"188","4.371158","182.161.74.8","192.168.219.118","TCP","66","443  >  49861 [FIN, ACK] Seq=64 Ack=2 Win=70 Len=0 TSval=3238358577 TSecr=3306447164"
"189","4.371313","192.168.219.118","182.161.74.8","TCP","54","49861  >  443 [RST] Seq=2 Win=0 Len=0"
"190","4.451187","216.22.16.4","192.168.219.118","TCP","66","443  >  49794 [ACK] Seq=65 Ack=2 Win=585 Len=0 TSval=2126377794 TSecr=1783901078"
"191","4.507486","192.168.219.118","224.0.0.251","MDNS","226","Standard query response 0x0000 TXT, cache flush NSEC, cache flush foxhouseâ\200\231s Mac mini._companion-link._tcp.local"
"192","4.507581","fe80::1878:8b22:1c97:d125","ff02::fb","MDNS","246","Standard query response 0x0000 TXT, cache flush NSEC, cache flush foxhouseâ\200\231s Mac mini._companion-link._tcp.local"
"193","4.938803","182.161.74.19","192.168.219.118","TLSv1.2","105","Application Data"
"194","4.938808","103.43.91.249","192.168.219.118","TLSv1.2","112","Application Data"
"195","4.938809","103.43.91.249","192.168.219.118","TLSv1.2","97","Encrypted Alert"
"196","4.938974","192.168.219.118","103.43.91.249","TCP","66","49792  >  443 [ACK] Seq=1 Ack=47 Win=2048 Len=0 TSval=292250072 TSecr=4087687825"
"197","4.939038","192.168.219.118","103.43.91.249","TCP","66","49792  >  443 [ACK] Seq=1 Ack=79 Win=2048 Len=0 TSval=292250072 TSecr=4087687825"
"198","4.939067","192.168.219.118","182.161.74.19","TCP","66","49885  >  443 [ACK] Seq=1 Ack=40 Win=2048 Len=0 TSval=1806337276 TSecr=729314745"
"199","4.939482","192.168.219.118","103.43.91.249","TCP","66","49792  >  443 [FIN, ACK] Seq=1 Ack=79 Win=2048 Len=0 TSval=292250072 TSecr=4087687825"
"200","4.939701","192.168.219.118","182.161.74.19","TCP","66","49885  >  443 [FIN, ACK] Seq=1 Ack=40 Win=2048 Len=0 TSval=1806337277 TSecr=729314745"
"201","4.986383","182.161.74.19","192.168.219.118","TCP","66","[TCP Previous segment not captured] 443  >  49885 [FIN, ACK] Seq=64 Ack=2 Win=73 Len=0 TSval=729314880 TSecr=1806337277"
"202","4.986385","182.161.74.19","192.168.219.118","TCP","90","[TCP Retransmission] 443  >  49885 [PSH, ACK] Seq=40 Ack=2 Win=73 Len=24 TSval=729314880 TSecr=1806337277"
"203","4.986488","192.168.219.118","182.161.74.19","TCP","78","[TCP Dup ACK 198#1] 49885  >  443 [ACK] Seq=2 Ack=40 Win=2048 Len=0 TSval=1806337323 TSecr=729314745 SLE=64 SRE=65"
"204","4.986595","192.168.219.118","182.161.74.19","TCP","54","49885  >  443 [RST] Seq=2 Win=0 Len=0"
"205","5.032189","182.161.74.19","192.168.219.118","TCP","54","443  >  49885 [RST] Seq=40 Win=0 Len=0"
"206","5.039988","103.43.91.249","192.168.219.118","TCP","66","443  >  49792 [ACK] Seq=79 Ack=2 Win=83 Len=0 TSval=4087687945 TSecr=292250072"
"207","5.092997","23.106.127.57","192.168.219.118","TLSv1.2","105","Application Data"
"208","5.093001","23.106.127.57","192.168.219.118","TLSv1.2","90","Application Data"
"209","5.093153","192.168.219.118","23.106.127.57","TCP","66","49849  >  443 [ACK] Seq=1 Ack=40 Win=2048 Len=0 TSval=2142872131 TSecr=3046346233"
"210","5.093212","192.168.219.118","23.106.127.57","TCP","66","49849  >  443 [ACK] Seq=1 Ack=65 Win=2048 Len=0 TSval=2142872131 TSecr=3046346233"
"211","5.093479","192.168.219.118","23.106.127.57","TCP","66","49849  >  443 [FIN, ACK] Seq=1 Ack=65 Win=2048 Len=0 TSval=2142872131 TSecr=3046346233"
"212","5.170343","23.106.127.57","192.168.219.118","TCP","66","443  >  49849 [ACK] Seq=65 Ack=2 Win=607 Len=0 TSval=3046346310 TSecr=2142872131"
"213","5.336277","182.161.74.38","192.168.219.118","TLSv1.2","105","Application Data"
"214","5.336438","192.168.219.118","182.161.74.38","TCP","66","49868  >  443 [ACK] Seq=1 Ack=40 Win=2048 Len=0 TSval=1482698220 TSecr=2780821490"
"215","5.336795","192.168.219.118","182.161.74.38","TCP","66","49868  >  443 [FIN, ACK] Seq=1 Ack=40 Win=2048 Len=0 TSval=1482698221 TSecr=2780821490"
"216","5.383510","182.161.74.38","192.168.219.118","TCP","66","[TCP Previous segment not captured] 443  >  49868 [FIN, ACK] Seq=64 Ack=2 Win=78 Len=0 TSval=2780821537 TSecr=1482698221"
"217","5.383512","182.161.74.38","192.168.219.118","TCP","90","[TCP Retransmission] 443  >  49868 [PSH, ACK] Seq=40 Ack=2 Win=78 Len=24 TSval=2780821537 TSecr=1482698221"
"218","5.383593","192.168.219.118","182.161.74.38","TCP","78","[TCP Dup ACK 214#1] 49868  >  443 [ACK] Seq=2 Ack=40 Win=2048 Len=0 TSval=1482698268 TSecr=2780821490 SLE=64 SRE=65"
"219","5.383698","192.168.219.118","182.161.74.38","TCP","54","49868  >  443 [RST] Seq=2 Win=0 Len=0"
"220","5.429274","182.161.74.38","192.168.219.118","TCP","54","443  >  49868 [RST] Seq=40 Win=0 Len=0"
"221","5.508508","192.168.219.118","224.0.0.251","MDNS","226","Standard query response 0x0000 TXT, cache flush NSEC, cache flush foxhouseâ\200\231s Mac mini._companion-link._tcp.local"
"222","5.508579","fe80::1878:8b22:1c97:d125","ff02::fb","MDNS","246","Standard query response 0x0000 TXT, cache flush NSEC, cache flush foxhouseâ\200\231s Mac mini._companion-link._tcp.local"
"223","5.539932","34.196.207.83","192.168.219.118","TCP","66","443  >  49820 [FIN, ACK] Seq=32 Ack=1 Win=196 Len=0 TSval=4173848249 TSecr=826144723"
"224","5.540068","192.168.219.118","34.196.207.83","TCP","66","49820  >  443 [ACK] Seq=1 Ack=33 Win=2048 Len=0 TSval=826149732 TSecr=4173848249"
"225","5.567389","54.239.33.159","192.168.219.118","TLSv1.2","78","Application Data"
"226","5.567392","54.239.33.159","192.168.219.118","TCP","54","443  >  49910 [FIN, ACK] Seq=25 Ack=1 Win=954 Len=0"
"227","5.567540","192.168.219.118","54.239.33.159","TCP","54","49910  >  443 [ACK] Seq=1 Ack=25 Win=4096 Len=0"
"228","5.567599","192.168.219.118","54.239.33.159","TCP","54","49910  >  443 [ACK] Seq=1 Ack=26 Win=4096 Len=0"
"229","5.759579","162.247.241.14","192.168.219.118","TCP","66","443  >  49722 [ACK] Seq=1 Ack=1 Win=16 Len=0 TSval=1620232363 TSecr=3192977789"
"230","5.759724","192.168.219.118","162.247.241.14","TCP","66","[TCP ACKed unseen segment] 49722  >  443 [ACK] Seq=1 Ack=2 Win=2048 Len=0 TSval=3192992869 TSecr=1620202225"
"231","5.816093","54.239.33.159","192.168.219.118","TLSv1.2","78","Application Data"
"232","5.816095","54.239.33.159","192.168.219.118","TCP","54","443  >  49917 [FIN, ACK] Seq=25 Ack=1 Win=954 Len=0"
"233","5.816251","192.168.219.118","54.239.33.159","TCP","54","49917  >  443 [ACK] Seq=1 Ack=25 Win=4096 Len=0"
"234","5.816318","192.168.219.118","54.239.33.159","TCP","54","49917  >  443 [ACK] Seq=1 Ack=26 Win=4096 Len=0"
"235","5.979069","162.247.241.14","192.168.219.118","TCP","66","443  >  49723 [ACK] Seq=1 Ack=1 Win=17 Len=0 TSval=1032466525 TSecr=1748845899"
"236","5.979212","192.168.219.118","162.247.241.14","TCP","66","[TCP ACKed unseen segment] 49723  >  443 [ACK] Seq=1 Ack=2 Win=2048 Len=0 TSval=1748861224 TSecr=1032436159"
"237","6.038626","162.247.241.14","192.168.219.118","TCP","66","443  >  49714 [ACK] Seq=1 Ack=1 Win=19 Len=0 TSval=2785314590 TSecr=283723855"
"238","6.038746","192.168.219.118","162.247.241.14","TCP","66","[TCP ACKed unseen segment] 49714  >  443 [ACK] Seq=1 Ack=2 Win=2048 Len=0 TSval=283739214 TSecr=2785284091"
"239","6.042938","162.247.241.14","192.168.219.118","TCP","66","443  >  49721 [ACK] Seq=1 Ack=1 Win=16 Len=0 TSval=2899261013 TSecr=1062852507"
"240","6.042997","192.168.219.118","162.247.241.14","TCP","66","[TCP ACKed unseen segment] 49721  >  443 [ACK] Seq=1 Ack=2 Win=2048 Len=0 TSval=1062867738 TSecr=2899230736"
"241","6.372463","162.247.241.14","192.168.219.118","TCP","66","443  >  49720 [ACK] Seq=1 Ack=1 Win=18 Len=0 TSval=1645943894 TSecr=2810732318"
"242","6.372593","192.168.219.118","162.247.241.14","TCP","66","[TCP ACKed unseen segment] 49720  >  443 [ACK] Seq=1 Ack=2 Win=2048 Len=0 TSval=2810747869 TSecr=1645913397"
"243","7.509195","192.168.219.118","224.0.0.251","MDNS","226","Standard query response 0x0000 TXT, cache flush NSEC, cache flush foxhouseâ\200\231s Mac mini._companion-link._tcp.local"
"244","7.509306","fe80::1878:8b22:1c97:d125","ff02::fb","MDNS","246","Standard query response 0x0000 TXT, cache flush NSEC, cache flush foxhouseâ\200\231s Mac mini._companion-link._tcp.local"
"245","8.041326","192.168.219.118","74.125.203.188","TCP","54","49680  >  5228 [ACK] Seq=1 Ack=1 Win=2048 Len=0"
"246","8.109735","74.125.203.188","192.168.219.118","TCP","66","[TCP ACKed unseen segment] 5228  >  49680 [ACK] Seq=1 Ack=2 Win=1044 Len=0 TSval=506294055 TSecr=1554147793"
"247","8.624546","0.0.0.0","255.255.255.255","DHCP","590","DHCP Discover - Transaction ID 0x8065a79e"
"248","9.137278","124.146.153.167","192.168.219.118","TLSv1.2","97","Encrypted Alert"
"249","9.137281","124.146.153.167","192.168.219.118","TCP","66","443  >  49825 [FIN, ACK] Seq=32 Ack=1 Win=74 Len=0 TSval=127965201 TSecr=1061843960"
"250","9.137434","192.168.219.118","124.146.153.167","TCP","66","49825  >  443 [ACK] Seq=1 Ack=32 Win=2048 Len=0 TSval=1061859003 TSecr=127965201"
"251","9.137510","192.168.219.118","124.146.153.167","TCP","66","49825  >  443 [ACK] Seq=1 Ack=33 Win=2048 Len=0 TSval=1061859003 TSecr=127965201"
"252","9.444479","52.220.31.28","192.168.219.118","TLSv1.2","97","Encrypted Alert"
"253","9.444483","52.220.31.28","192.168.219.118","TLSv1.2","97","Encrypted Alert"
"254","9.444484","52.220.31.28","192.168.219.118","TLSv1.2","97","Encrypted Alert"
"255","9.444640","192.168.219.118","52.220.31.28","TCP","66","49843  >  443 [ACK] Seq=1 Ack=32 Win=2048 Len=0 TSval=2691148828 TSecr=523471008"
"256","9.444700","192.168.219.118","52.220.31.28","TCP","66","49840  >  443 [ACK] Seq=1 Ack=32 Win=2048 Len=0 TSval=2335533865 TSecr=3835239359"
"257","9.444716","192.168.219.118","52.220.31.28","TCP","66","49854  >  443 [ACK] Seq=1 Ack=32 Win=2048 Len=0 TSval=3440330385 TSecr=1311307817"
"258","9.854073","52.220.31.28","192.168.219.118","TLSv1.2","97","Encrypted Alert"
"259","9.854210","192.168.219.118","52.220.31.28","TCP","66","49842  >  443 [ACK] Seq=1 Ack=32 Win=2048 Len=0 TSval=1488018097 TSecr=3835239793"
"260","9.878274","192.168.219.118","172.67.213.25","UDP","1292","65416  >  443 Len=1250"
"261","9.878332","192.168.219.118","172.67.213.25","UDP","428","65416  >  443 Len=386"
"262","9.878671","192.168.219.118","142.250.197.4","TLSv1.2","1405","Application Data"
"263","9.878714","192.168.219.118","142.250.197.4","TLSv1.2","105","Application Data"
"264","9.878730","192.168.219.118","142.250.197.4","TLSv1.2","101","Application Data"
"265","9.880340","192.168.219.118","142.250.197.4","TCP","1466","49687  >  443 [ACK] Seq=1414 Ack=1 Win=4455 Len=1400 TSval=2990864031 TSecr=3693796541 [TCP PDU reassembled in 266]"
"266","9.880374","192.168.219.118","142.250.197.4","TLSv1.2","437","Application Data"
"267","9.881380","192.168.219.118","142.250.198.106","QUIC","1292","Initial, DCID=2fc42a81e4e2bfa9, PKN: 1, CRYPTO, PADDING, CRYPTO, PADDING, CRYPTO, PADDING, PING, CRYPTO, PADDING, PING, PADDING, PING, CRYPTO, CRYPTO, PADDING, PING, PADDING, CRYPTO, CRYPTO, PADDING, CRYPTO, PADDING, CRYPTO"
"268","9.881410","192.168.219.118","142.250.198.106","QUIC","1292","Initial, DCID=2fc42a81e4e2bfa9, PKN: 2, CRYPTO, PADDING, CRYPTO, PING, CRYPTO, PADDING, CRYPTO, PADDING, CRYPTO, PADDING, CRYPTO, PADDING, PING"
"269","9.885007","192.168.219.118","142.250.198.35","QUIC","1292","Initial, DCID=0306f62478ba1112, PKN: 1, PING, CRYPTO, PING, CRYPTO, CRYPTO, PING, CRYPTO, CRYPTO, PING"
"270","9.885018","192.168.219.118","142.250.198.35","QUIC","1292","Initial, DCID=0306f62478ba1112, PKN: 2, PING, CRYPTO, CRYPTO, PING, CRYPTO, PING, PING, CRYPTO"
"271","9.885137","192.168.219.118","142.250.198.35","QUIC","121","0-RTT, DCID=0306f62478ba1112"
"272","9.922864","172.67.213.25","192.168.219.118","UDP","66","443  >  65416 Len=24"
"273","9.936840","172.67.213.25","192.168.219.118","UDP","1242","443  >  65416 Len=1200"
"274","9.936841","172.67.213.25","192.168.219.118","UDP","1046","443  >  65416 Len=1004"
"275","9.942132","192.168.219.118","142.250.197.4","TLSv1.2","1151","Application Data"
"276","9.942839","192.168.219.118","172.67.213.25","UDP","1292","65416  >  443 Len=1250"
"277","9.942851","192.168.219.118","172.67.213.25","UDP","363","65416  >  443 Len=321"
"278","9.942912","192.168.219.118","172.67.213.25","UDP","1292","65416  >  443 Len=1250"
"279","9.942916","192.168.219.118","172.67.213.25","UDP","363","65416  >  443 Len=321"
"280","9.942991","192.168.219.118","104.17.122.62","TLSv1.2","187","Application Data"
"281","9.942999","192.168.219.118","104.17.122.62","TLSv1.2","105","Application Data"
"282","9.943222","192.168.219.118","104.26.2.232","TLSv1.2","201","Application Data"
"283","9.943231","192.168.219.118","104.26.2.232","TLSv1.2","105","Application Data"
"284","9.954988","104.17.122.62","192.168.219.118","TCP","66","443  >  49738 [ACK] Seq=1 Ack=161 Win=16 Len=0 TSval=1238888240 TSecr=3169649302"
"285","9.954990","104.17.122.62","192.168.219.118","TLSv1.2","105","Application Data"
"286","9.955143","192.168.219.118","104.17.122.62","TCP","66","49738  >  443 [ACK] Seq=161 Ack=40 Win=2048 Len=0 TSval=3169649314 TSecr=1238888240"
"287","9.966377","104.17.122.62","192.168.219.118","TLSv1.2","158","Application Data"
"288","9.966508","192.168.219.118","104.17.122.62","TCP","66","49738  >  443 [ACK] Seq=161 Ack=132 Win=2047 Len=0 TSval=3169649325 TSecr=1238888252"
"289","9.966736","192.168.219.118","104.17.122.62","TLSv1.2","101","Application Data"
"290","9.968228","142.250.198.106","192.168.219.118","QUIC","82","Initial, SCID=efc42a81e4e2bfa9, PKN: 1, ACK"
"291","9.969025","142.250.198.106","192.168.219.118","QUIC","1292","Initial, SCID=efc42a81e4e2bfa9, PKN: 2, ACK, PADDING"
"292","9.969026","142.250.198.106","192.168.219.118","QUIC","1292","Initial, SCID=efc42a81e4e2bfa9, PKN: 3, CRYPTO, PADDING"
"293","9.969028","142.250.198.106","192.168.219.118","QUIC","1292","Initial, SCID=efc42a81e4e2bfa9, PKN: 4, CRYPTO, PADDING"
"294","9.969199","192.168.219.118","142.250.198.106","QUIC","1292","Initial, DCID=efc42a81e4e2bfa9, PKN: 3, ACK, PADDING"
"295","9.970751","142.250.197.4","192.168.219.118","TCP","66","443  >  49687 [ACK] Seq=1 Ack=1340 Win=719 Len=0 TSval=3693807615 TSecr=2990864030"
"296","9.970753","142.250.197.4","192.168.219.118","TCP","66","443  >  49687 [ACK] Seq=1 Ack=1379 Win=719 Len=0 TSval=3693807615 TSecr=2990864030"
"297","9.970754","142.250.197.4","192.168.219.118","TCP","66","443  >  49687 [ACK] Seq=1 Ack=1414 Win=719 Len=0 TSval=3693807615 TSecr=2990864030"
"298","9.971067","142.250.198.35","192.168.219.118","QUIC","82","Initial, SCID=e306f62478ba1112, PKN: 1, ACK"
"299","9.971069","142.250.198.35","192.168.219.118","QUIC","1292","Initial, SCID=e306f62478ba1112, PKN: 2, ACK, PADDING"
"300","9.971071","142.250.197.4","192.168.219.118","TLSv1.2","105","Application Data"
"301","9.971123","192.168.219.118","142.250.197.4","TCP","66","49687  >  443 [ACK] Seq=4270 Ack=40 Win=4455 Len=0 TSval=2990864122 TSecr=3693807615"
"302","9.971346","142.250.197.4","192.168.219.118","TCP","66","443  >  49687 [ACK] Seq=40 Ack=3185 Win=740 Len=0 TSval=3693807616 TSecr=2990864031"
"303","9.984877","104.26.2.232","192.168.219.118","TCP","66","443  >  49737 [ACK] Seq=1 Ack=175 Win=16 Len=0 TSval=1363694850 TSecr=993606925"
"304","9.984879","104.26.2.232","192.168.219.118","TLSv1.2","105","Application Data"
"305","9.985010","192.168.219.118","104.26.2.232","TCP","66","49737  >  443 [ACK] Seq=175 Ack=40 Win=8555 Len=0 TSval=993606967 TSecr=1363694850"
"306","9.987709","172.67.213.25","192.168.219.118","UDP","66","443  >  65416 Len=24"
"307","9.992333","142.250.198.106","192.168.219.118","QUIC","1292","Handshake, SCID=efc42a81e4e2bfa9"
"308","9.992337","142.250.198.106","192.168.219.118","QUIC","1265","Handshake, SCID=efc42a81e4e2bfa9"
"309","9.992340","142.250.198.106","192.168.219.118","QUIC","107","Protected Payload (KP0)"
"310","9.992342","104.26.2.232","192.168.219.118","TLSv1.2","559","Application Data"
"311","9.992471","192.168.219.118","104.26.2.232","TCP","66","49737  >  443 [ACK] Seq=175 Ack=533 Win=8548 Len=0 TSval=993606974 TSecr=1363694857"
"312","9.992953","192.168.219.118","142.250.198.106","QUIC","81","Handshake, DCID=efc42a81e4e2bfa9"
"313","9.992955","192.168.219.118","142.250.198.106","QUIC","196","Protected Payload (KP0), DCID=efc42a81e4e2bfa9"
"314","9.992975","192.168.219.118","104.26.2.232","TLSv1.2","101","Application Data"
